Id,Name,Location,Website,Domain,Description,Industry,EmployeeCount,Logo,EmployeeCountRange,Headquarters,Country,GeographicArea,City,PostalCode,AddressLine2,AddressLine1,Created,Modified,PublicProfileUrl
73972074,YUXTAA,"Dhaka, Dhaka, Bangladesh",http://www.yuxtaa.com,yuxtaa.com,,Consumer Services,1,https://media-exp1.licdn.com/dms/image/C4E0BAQGtz_vJEsITsQ/company-logo_400_400/0/1607684192207?e=1616630400&v=beta&t=CKK1oeXdOcj_xJPGW8yIswD1Ji5nL5Fx0c9xgwsFtTA,Nov-50,"67/B, Indira Road, Dhaka ,Dhaka,Dhaka,Bangladesh",Bangladesh,Dhaka,Dhaka,1215,,"67/B, Indira Road, Dhaka ",24/12/2020 13:15,24/12/2020 13:15,https://www.linkedin.com/company/yuxtaa/
73971453,ELEMNTS,"London, England, United Kingdom",http://www.elemntsmarket.com,elemntsmarket.com,"Whether it’s an Ecommerce business or a training company, we take a look at what your sales & indoctrination process looks like and we start there. Plug the leaky holes, then drive highly qualified leads. ",Marketing and Advertising,1,https://media-exp1.licdn.com/dms/image/C4E0BAQFWIcm21gF2Kw/company-logo_400_400/0/1607696957757?e=1617840000&v=beta&t=QWN0VMvyaV-hRFCxMllWjQy264GZszun4l1N6-RarXo,Nov-50,"London,United Kingdom",United Kingdom,,London,,,,01/01/2021 17:52,01/01/2021 17:52,https://www.linkedin.com/company/elemntsofficial/
73969509,ON-ARCH,"Łódź, Łódzkie, Poland",https://www.on-arch.pl/,on-arch.pl,"INTERIOR DESIGN COURSES AND TRAININGS If you dream about being an interior designer, but you do not have enought knowledge and experience - please come to us and we will show you a world of interiors",Architecture & Planning,2,https://media-exp1.licdn.com/dms/image/C4E0BAQECOOlnBRzPHA/company-logo_400_400/0/1607683771152?e=1618444800&v=beta&t=2FfVpjPZpuIjyVDVLWGVlV8UfOm77pbcPQQFovhJmN8,Nov-50,"Tymienieckiego,25D/53,łódzkie,Łódź,Poland",Poland,łódzkie,Łódź,90-350,25D/53,Tymienieckiego,08/01/2021 12:39,08/01/2021 12:39,https://www.linkedin.com/company/on-arch/
73969402,Hinkley Professional Services Group,"Somerset, England, United Kingdom",https://www.hinkleypsg.co.uk/,hinkleypsg.co.uk,"Hinkley PSG was formed in 2017 and is a collection of businesses that have either direct experience of advising businesses or consortia already involved in the Hinkley Point C project or relevant transferable experience.  The overriding principle is that members of Hinkley PSG are collaborative, bring valued experience becoming trusted advisors to their clients. All Hinkley PSG group members are committed to share best practice, through case studies, videos, workshops, and information sheets. Initial free consultations are available and to be an ambassador for new nuclear energy projects. Members who have been carefully chosen and include law firms, accountancy practices, finance companies, finance brokers, human resource, and project management specialists, along with selected collaborators. All can provide advice as businesses go through various stages of contracts including tender preparation, NEC3 and other contract negotiation, mobilisation, and contract delivery. The Hinkley PSG is endorsed by the Hinkley Supply Chain and supported by Hinkley Point C.",Construction,1,https://media-exp1.licdn.com/dms/image/C4E0BAQGOrPAj5b6l_A/company-logo_400_400/0/1607679740668?e=1617840000&v=beta&t=pCsDcCxxfYKDV_NKo4v3xXAYnQGDlclpgxXTOnFBxfA,myself only,"Somerset,United Kingdom",United Kingdom,,Somerset,,,,05/01/2021 17:03,05/01/2021 17:03,https://www.linkedin.com/company/hinkleypsg/
73968831,Ideoxy,"Warsaw, Mazowieckie, Poland",http://www.ideoxy.com,ideoxy.com,,Marketing and Advertising,1,https://media-exp1.licdn.com/dms/image/C4E0BAQE9SZdQxXcPZg/company-logo_400_400/0/1607693056198?e=1617840000&v=beta&t=4op3qmGeZgeFiAg_W57gQZorH6sp0O3fEpLHV6DqYXg,02-Oct,"Al. Jerozolimskie,85/21,Warszawa,Poland",Poland,,Warszawa,02-001,85/21,Al. Jerozolimskie,01/01/2021 18:21,01/01/2021 18:21,https://www.linkedin.com/company/ideoxy/
73968413,BEAUTY KART ,,http://www.beauty-kart.com,beauty-kart.com,,Retail,2,https://media-exp1.licdn.com/dms/image/C4E0BAQFbHgbXb7RVoA/company-logo_400_400/0/1607678287907?e=1616025600&v=beta&t=6s_xNp4ZXRBBycGbux_s50cjxQkacTchPsjrDuESVx0,201-500,,,,,,,,11/12/2020 16:13,11/12/2020 16:13,https://www.linkedin.com/company/beauty-kart/
73968134,Bjuvs Städservice ,"Bjuv, Skane County, Sweden",http://bjuvsstadservice.nu,bjuvsstadservice.nu,OM OSS Bjuvs Städservice erbjuder tjänster inom lokalvård. Vi utför tjänster alltifrån flyttstädning och hemstädning till fönsterputs och kontorsstädning.  Vi är ett gäng ambitiösa och kompetenta medarbetare som gör vårt yttersta för att möta era krav. För oss är det givetvis viktigt att ni blir nöjda! Våra tjänster är prisvärda och vi lägger stort fokus på service och kundnöjdhet så gör som många andra och kontakta oss när det är dags  Kontakt Önskar ni en kostnadsfri offert eller har ni andra frågor och funderingar? Hör gärna av er till oss på nedan kontaktuppgifter.  070-817 85 17 bjuvsstadservice@gmail.com,Individual & Family Services,1,https://media-exp1.licdn.com/dms/image/C4E0BAQHt5OkH6GBOKA/company-logo_400_400/0/1607668569090?e=1616025600&v=beta&t=HRtIs33-RN8dWFeRJLdbKFNDNzx66SURJ6xygZc-6DY,02-Oct,"Västra Ringgatan 3b,1001,Skåne,Bjuv,Sweden",Sweden,Skåne,Bjuv,267 31,1001,Västra Ringgatan 3b,16/12/2020 11:04,16/12/2020 11:04,https://www.linkedin.com/company/bjuvs-st%C3%A4dservice/
73967761,Armstrong Projects,"Altrincham, England, United Kingdom",https://www.armstrong-uk.com/,armstrong-uk.com,"Armstrong Projects are a construction specialist with expertise in construction for a wide variety of sectors. Offering a comprehensive turn-key construction service with our partnered design teams along with a healthy database of approved supply chain partners. Our services can be individually tailored to meet our clients specific requirements and our effective Project Management ensures that client expectations of quality, programme and budgets are met. We consider health and safety to be at the forefront of our projects. Our staff are trained and qualified to the latest H&S standards and relevant management qualifications.",Construction,4,https://media-exp1.licdn.com/dms/image/C4E0BAQEltTifMTFSsQ/company-logo_400_400/0/1607692167394?e=1616630400&v=beta&t=DsqpO0U-50mrwcgxCSw-0JRe_iFxj-Dl_bGgm7Zhkxs,Nov-50,"The Annexe, Rear of 26 Church Street,Altrincham,United Kingdom",United Kingdom,,Altrincham,WA14 4DW,,"The Annexe, Rear of 26 Church Street",21/12/2020 14:51,21/12/2020 14:51,https://www.linkedin.com/company/armstrong-projects-ltd/
73967639,Ribble Valley Pods,"Clayton-le-Dale, England, United Kingdom",http://www.ribblevalleypods.co.uk,ribblevalleypods.co.uk,Manufacturer of luxury glamping pods in the Ribble Valley ,"Leisure, Travel & Tourism",2,https://media-exp1.licdn.com/dms/image/C4E0BAQERbC3m-vh3LQ/company-logo_400_400/0/1607683939064?e=1616025600&v=beta&t=AeTCPYxIRrvCITrfPnkcQiLrhQjWIV4StZ69gXTRdlQ,Nov-50,"Le Dale Park,Lancashire,Clayton-le-Dale,United Kingdom",United Kingdom,Lancashire,Clayton-le-Dale,BB1 9EX,,Le Dale Park,13/12/2020 17:33,13/12/2020 17:33,https://www.linkedin.com/company/ribble-valley-pods/
73967189,SPORTLiGHT,,http://www.sportlight.com,sportlight.com," n today’s age when news media and sport media mirror one another in spectacle, where big media delivers more infotainment than information, a need emerges to provide the world with interesting, accurate, and important sport news. For too long, the world of sport itself has offered little more than celebrity without substance, a streaming supply of drills, and myopic perspectives shallow in insight. SPORTLiGHT addresses the real need to captivate consumers’ attention, while being the leading source for accurate information that matters. Backed by science and critical thought, SPORTLiGHT is the first of its kind sport media company that educates, entertains, and engages for the relentless pursuit of understanding and improving society through the power of sport.",Sports,2,https://media-exp1.licdn.com/dms/image/C4E0BAQGzlN7QeBqzZQ/company-logo_400_400/0/1607655810995?e=1616025600&v=beta&t=KkHp5wBvQMl36Zshp9gen7K7Ygor9qIVutMcfglvnKo,02-Oct,,,,,,,,11/12/2020 19:48,11/12/2020 19:48,https://www.linkedin.com/company/sportlightmedia/
73966814,In Good Company,"London, England, United Kingdom",http://igccollective.com,igccollective.com,"In Good Company is a collaborative global network of talented individuals who enjoy working together. The heart of the collective was formed through a unique creative partnership, where complementary skill-sets rather than like-mindedness is at the crux of the relationship.   The core of our belief system is based on the idea that with Good people at the center of what we do, we can achieve work of the highest caliber.   This shared belief spans both agency and client relationships. We want to work with Good people, for Good brands, and have Good times while doing so.  ",Marketing and Advertising,2,https://media-exp1.licdn.com/dms/image/C4E0BAQHEbTM8t55GBA/company-logo_400_400/0/1607682517833?e=1616025600&v=beta&t=-29_RYg9CWOv1ft5-Qb6LBm5UAYDjvZ6SE9hLRh-DeM,02-Oct,"London,United Kingdom",United Kingdom,,London,,,,15/12/2020 10:36,15/12/2020 10:36,https://www.linkedin.com/company/in-good-company-collective/
73963081,Adapsyn Bioscience,"Hamilton, Ontario, Canada",https://adapsyn.com,adapsyn.com,"We apply proprietary computational tools to bacterial metabolomic and genomic data in order to identify, isolate, and assay novel drug-like small molecules in high-throughput to expedite the search for medicines that will better protect us from a wide spectrum of diseases.",Biotechnology,5,https://media-exp1.licdn.com/dms/image/C4E0BAQECjjoeBTX_Dg/company-logo_400_400/0/1607629950358?e=1615420800&v=beta&t=HUYiDQ6vngD6wKAt9OGDUY8UowmJ6dTvd9wiQy0Cr9U,02-Oct,"175 Longwood Rd S,Ontario,Hamilton,Canada",Canada,Ontario,Hamilton,L8P 0A1,,175 Longwood Rd S,10/12/2020 21:31,10/12/2020 21:31,https://www.linkedin.com/company/adapsyn/
73962669, elsewhere,"Savannah, Georgia, United States",http://elsewhere.io,elsewhere.io,"elsewhere is a flexible and socially conscious travel company with an impact-driven approach and direct-to-consumer model.   Born from the idea that travelers—and the destinations they visit—deserve better than the all-too-traditional travel space, elsewhere focuses on a model of economic fairness and environmental protection for the destination, as well as extraordinary experiences for travelers. The direct-to-local model we use not only ensures that travel dollars stay local, but offers an alternative to mass tourism that’s led by the communities themselves. At elsewhere, we pride ourselves on our badass network and ensuring that there’s a positive local impact from every trip sold.  We’ll let you know when it’s time to start packing. See you in 2021✌️ ","Leisure, Travel & Tourism",4,https://media-exp1.licdn.com/dms/image/C4E0BAQEPyqZK0SPUaQ/company-logo_400_400/0/1607656976192?e=1617235200&v=beta&t=uWIEaJnjVtpxkJNFnT6cdSmW8hHIsQPvKGe4f-BPphg,02-Oct,"177 Yam Gandy Rd,Georgia,Savannah,United States",United States,Georgia,Savannah,31411,,177 Yam Gandy Rd,31/12/2020 10:36,31/12/2020 10:36,https://www.linkedin.com/company/elsewhereio/
73962484,JPK9ACADEMY,"Sacramento, California, United States",http://www.jpk9academy.com,jpk9academy.com,,Professional Training & Coaching,1,https://media-exp1.licdn.com/dms/image/C4E0BAQEcgIeQ4VziHg/company-logo_400_400/0/1607640616567?e=1616025600&v=beta&t=t9mcCbDpf3MbZ3rviVzTrp50K0jy-CMTbqbawB177-U,02-Oct,"California,SACRAMENTO,United States",United States,California,SACRAMENTO,95828,,,11/12/2020 14:25,11/12/2020 14:25,https://www.linkedin.com/company/jpk9academy/
73961213,Bifröst,"Paris, Île-de-France, France",https://bifrost.re/,bifrost.re,"Bifröst is a digital marketplace to enable all the reinsurance market participants (insurers, reinsurers, brokers) to trade and transfer risks in the most transparent, robust and efficient way.  Our goal is to support the reinsurance market and its participants in their transition to a more digital way of working. Our solution relies on state-of-the-art market design, auctions and optimization. We recognize the importance of the business relationship in insurer-broker-reinsurer negotiations and interactions, our market design features effectively capture the key elements of this commercial relationship and all the constraints inherent to this market.  Bifröst is a member of the Entrepreneur First family, based out of Paris, France.  Get in touch at contact@bifrost.re !",Insurance,2,https://media-exp1.licdn.com/dms/image/C4E0BAQFJxTi1UrMLyA/company-logo_400_400/0/1607620337628?e=1616630400&v=beta&t=Jvtg7V2N_o33BQyqHybd3VN7JkY8DysFTZ7SLcqgams,02-Oct,"Station F, 5 Parvis Alan Turing,Paris,France",France,,Paris,75013,,"Station F, 5 Parvis Alan Turing",22/12/2020 17:02,22/12/2020 17:02,https://www.linkedin.com/company/bifr%C3%B6st/
73961019,HomeSwitch,"Stockholm, Stockholm County, Sweden",https://homeswitch.uk/,homeswitch.uk,Energy savings with a focusing on eco. Whilst also delivering from. Our partners competitive quotes in useful verticals. ,Marketing and Advertising,1,https://media-exp1.licdn.com/dms/image/C4E0BAQES3hgvvQgpAw/company-logo_400_400/0/1607614358933?e=1616025600&v=beta&t=vdjP2P4Q_EzxDgh_5H_IOpRw6BGklfHtj9sXo6iNd24,02-Oct,"Lidingo ,Lidingo,Stockholm ,Sweden",Sweden,Lidingo,Stockholm ,,,Lidingo ,14/12/2020 11:37,14/12/2020 11:37,https://www.linkedin.com/company/home-switch/
73960906,Brooks The Jeweller,,http://www.brooksthejeweller.co.uk,brooksthejeweller.co.uk,,Retail,2,https://media-exp1.licdn.com/dms/image/C4E0BAQGbeGjXVdCkbw/company-logo_400_400/0/1607610843732?e=1616025600&v=beta&t=qdKXQlG0OsDmDPQL-yG0A9_AflBidyeTO4LDji3idYo,02-Oct,,,,,,,,13/12/2020 17:41,13/12/2020 17:41,https://www.linkedin.com/company/brooksthejeweller/
73960447,Forbes Global Properties,"Beverly Hills, California, United States",http://forbesglobalproperties.com,forbesglobalproperties.com,"Forbes Global Properties is a curated consumer marketplace that uniquely showcases a coveted collection of homes and the stories behind them. Established as an invitation-only consortium of leading real estate firms, the network capitalizes on Forbes’ engaged audience of more than 100 million monthly global visitors to directly connect, inspire, and inform high-net-worth potential homebuyers and sellers about the finest properties for sale around the world.    Established and led by the world’s leading luxury residential brokers and industry veterans, Forbes Global Properties supports independent firms who transact at the top of their respective markets. Members benefit from a robust suite of tools and resources backed by actionable analytics, editorial and social media content, a dedicated page on forbes.com, as well as exclusive advertising opportunities and access to Forbes’ premier touchpoints.   Unlike other luxury real estate membership groups, Forbes Global Properties does not impose referral fees, and offers individual property owners and top agents in select non-member locations the opportunity to promote their homes through the powerful network with immediate exposure to a far-reaching audience.  For more information, visit forbesglobalproperties.com ",Real Estate,7,https://media-exp1.licdn.com/dms/image/C4E0BAQH9vGNrUPr8TQ/company-logo_400_400/0/1607644781754?e=1617840000&v=beta&t=yDofYArUOoKNy61U4X8oEjAbU6iq8l2B5imbWrDgvRM,201-500,"257 North Canon Drive,California,Beverly Hills,United States",United States,California,Beverly Hills,90210,,257 North Canon Drive,01/01/2021 20:05,01/01/2021 20:05,https://www.linkedin.com/company/forbesglobalproperties/
73958522,Appleton IT Solutions,"Pontefract, England, United Kingdom",https://www.aitsolutions.org,aitsolutions.org,"Appleton IT Solutions is a newly established Computer Sales and Repairs shop based in Pontefract, West Yorkshire. With many years of experience and access to great products and prices, we pride ourselves in being able to provide a value-added computer sales service.  Here at AIT we believe in fair, honest and transparent pricing and operate on a fixed fee labour basis. Advice is completely free, small tasks are a Lite £25, routine tasks a Standard £50 and new computer builds/major changes just an extended £100.  All new materials are charged at cost without a markup for builds and come with a 12 month warranty from us in addition to any manufacturer warranties offered. In the interest of transparency do note we have a 20% restocking fee on any opened returns that aren't faulty.  As part of our service, we always discuss any replacement hardware with you including any alternatives and we will never perform a repair without your approval. In the event you don't want us to carry out any repair then only a Lite £25 fee is charged for our time.  Payments can be made by bank transfer, online card payment or by cash and are payable prior to collection of your item.",Computer Hardware,1,https://media-exp1.licdn.com/dms/image/C4E0BAQGiGiclH5eK_w/company-logo_400_400/0/1607619133066?e=1616025600&v=beta&t=waa5GSWx5qmTz7I6Z_xm1IDTwDQjYtYKEFQytREEkG8,myself only,"Pontefract,United Kingdom",United Kingdom,,Pontefract,WF8 4EP,,,11/12/2020 22:51,11/12/2020 22:51,https://www.linkedin.com/company/appleton-it-solutions/
73958489,Unosounds,"Grays Inn, England, United Kingdom",http://www.unosounds.com,unosounds.com,,Consumer Electronics,2,https://media-exp1.licdn.com/dms/image/C4E0BAQEFsCcZQik1WQ/company-logo_400_400/0/1607617817381?e=1617840000&v=beta&t=3UMhue3yaaXlA_ev-buNBZyrnE3nQHNMDW5erMmBAEk,Nov-50,"2, Fredrick Street, Kings Cross,London,United Kingdom",United Kingdom,,London,WC1X0ND,,"2, Fredrick Street, Kings Cross",04/01/2021 13:52,04/01/2021 13:52,https://www.linkedin.com/company/unosounds-ltd/
73957597,Palion Medical,Norway,http://www.multiguide.no,multiguide.no,"We are a medical device company focused on developing precision medicine solutions that improve outcomes and minimise side effects.  Developed from research at the Norwegian University of Science and Technology and St. Olav's University Hospital, Trondheim our initial product, Multiguide, is a highly precise injection system that is partnered with a proprietary, simple & easy to use handheld neuro-navigation system to deliver nerve blocks for the treatment of severe headache disorders.  Our belief is that this technology will significantly lower the cost and complexity associated with image guided interventions and by facilitating a shift from general to local anaesthesia, increase intervention accessibility. As a result, MultiGuide & miniNAV may represent a shift from highly specialised procedures performed by few, to easy-to-perform procedures within the reach of any surgeon or physician.   These significant advantages open possibilities not yet seen for image guide procedures and our aim is to develop our technology for a variety of procedures involving image guided navigation.",Medical Devices,1,https://media-exp1.licdn.com/dms/image/C4E0BAQFNOw5lUGhUNw/company-logo_400_400/0/1607620470686?e=1618444800&v=beta&t=DcU97hquW8Tl3I0FZb-BB9H5s23GZuFzXeoSfw0Tpgk,02-Oct,"Tondheim,Norway",Norway,,Tondheim,,,,11/01/2021 11:41,11/01/2021 11:41,https://www.linkedin.com/company/palionmedical/
73957554,Lakeside FS,"Barnsley, England, United Kingdom",https://www.lakesidefs.co.uk/,lakesidefs.co.uk,"Lakeside is a family run business with a history of over twenty-five years of looking after our client's long-term financial well-being. Interestingly we find that our clients who get the most benefit from our service are those where we look after all family members. Whomever you class as “your” financial adviser, at Lakeside everyone is happy to try and help, you are working with a team dedicated to friendly, quality service.  FCA Regulated Products & Services Overview We provide a wide range of products and services which we can discuss in detail with you but as a quick overview the following products are generally relevant to many people.  - Pensions - Retirement Planning - Investments - ISAs - Investment Bonds - Cashflow Modelling - Residential Mortgages - Buy to Let Mortgages - Equity Release - Secured Loans - Debt Consolidation - Capital Raising - Critical Illness Cover - Income Protection - Life Insurance - Buildings and Contents - Private Medical - General Insurance  Non-Regulated Products from Lakeside Wills Ltd.  - Simple Wills - Property Protection - Discretionary Trusts - Estate Planning - Power of Attorney - Probate Services  The planning cycle Setting up a financial plan isn’t just a one-off decision, it makes sense to keep them under review. Once we know about you and what you want to achieve, we can design a plan for you, set up any products that you might need and then keep your investments under review. Every now and again, we suggest you contact every one or two years, we should sit down and review your overall plan.",Financial Services,3,https://media-exp1.licdn.com/dms/image/C4E0BAQHDTnvw0zifHQ/company-logo_400_400/0/1607618988897?e=1616025600&v=beta&t=XxcUJtoigSUNWmjFDQoj43EkMBmKLq55Cy1PMKGGOG0,02-Oct,"Biz Hub,Wharncliffe Business Park,South Yorkshire,Barnsley,United Kingdom",United Kingdom,South Yorkshire,Barnsley,S71 3GN,Wharncliffe Business Park,Biz Hub,12/12/2020 00:51,12/12/2020 00:51,https://www.linkedin.com/company/lakeside-fs-ltd/
73957381,Electronic Models,,https://stores.electronicmodels.com/,stores.electronicmodels.com,"The idea of producing electronic boards came about when I started working with Arduinos and understanding more about electronics. From there, Electronic Models was born. The idea is to create electronic boards that can control everything that exists in a model train: from the light signal to the roundabouts, from the street lights to the junctions. In addition to being plug-and-play (they connect to each other without any configuration), you can also control the objects remotely, either via Wi-Fi (using a computer, tablet, or smartphone) or via Bluetooth (using a smartphone). Despite all the features, the boards will be affordable and will feature detailed documentation. The boards are designed by me and then printed by a company specifically dedicated to this purpose. In the coming weeks, more news will be released, so I invite you to stay tuned and subscribe to the Facebook page.",Manufatura de eletroeletrônicos,1,https://media-exp1.licdn.com/dms/image/C4E0BAQHjr2s45xwu9Q/company-logo_400_400/0/1607610625034?e=1616630400&v=beta&t=Rs8TSlLaFDYNW0SdDeuLzI0mL_cJ3NsxaqhW9H2RMow,myself only,,,,,,,,24/12/2020 10:33,24/12/2020 10:33,https://www.linkedin.com/company/electronic-models/
73957303,Hippocampus Academy,"Wichita Falls, Texas, United States",https://hippocampus-academy.business.site/,hippocampus-academy.business.site,"Hippocampus Academy is a private international school committed to bringing a language-forward curriculum to students around the world. It offers fully-accredited curriculum to exceptional students from more than 30 countries, offering students a unique opportunity to build a worldwide network of peers who share their academic goals, drive, and commitment to greatness.  Hippocampus Academy is an American K-12 school. It was established and is run by current and former University professors and only employs the most highly-qualified teachers in their respective fields. It offers live one-on-one, live group, asynchronous, project-based, and self-developed virtual courses, and is committed to meeting every child's needs to the fullest.",Primary/Secondary Education,1,https://media-exp1.licdn.com/dms/image/C4E0BAQGPzcbHW6sTNw/company-logo_400_400/0/1607608323610?e=1618444800&v=beta&t=jVjosSezRemdgHfojlJI_Hh4id2BkXFX0K6Fk7N-T30,Nov-50,"900 8th Street ,Suite 714,Texas,Wichita Falls,United States",United States,Texas,Wichita Falls,76301,Suite 714,900 8th Street ,09/01/2021 17:01,09/01/2021 17:01,https://www.linkedin.com/company/hippocampusacademy/
73956834,Olah,"Denver, North Carolina, United States",http://www.sayolah.com,sayolah.com,"Olah is a brand focused on creating 100% natural, plant-based, and sustainable CBD products. Olah promotes creativity, performance, and wellness.  We are a young team with an entrepreneurial spirit passionate about Cannabinoids and Hemp.  ","Health, Wellness and Fitness",2,https://media-exp1.licdn.com/dms/image/C4E0BAQE9PtQK4kR3wA/company-logo_400_400/0/1607625373956?e=1618444800&v=beta&t=Keo5oQH9FpxSf8Mek3QP9wtoNMXTqzeeSvulf3vG8fw,02-Oct,"Denver,United States",United States,,Denver,,,,08/01/2021 12:28,08/01/2021 12:28,https://www.linkedin.com/company/olah/
73956107,NSI Consultancy,"Whitechapel, England, United Kingdom",http://nsiconsultancyltd.co.uk/,nsiconsultancyltd.co.uk,"We are an established consultancy firm focused on serving the comprehensive needs of businesses in the full range of the business cycle. Our professionals and a team approach to most consulting projects, we offer a more balanced quality service. Our consultants and Subcontractors provide a wide range of business consulting services to other start-ups and companies in all stages of their operations. We specialise in a particular discipline, including finance, sales and marketing, technology, management, operations, and human resources. Our head office is situated very close to London’s Silicon Valley. ",Business Supplies and Equipment,1,https://media-exp1.licdn.com/dms/image/C4E0BAQFgn8bEDkQOtg/company-logo_400_400/0/1607600196835?e=1617235200&v=beta&t=GNavpoCp8J-yL0-r9WLCJLxNeS79QzBp37Ohn6DpLoE,02-Oct,"102-105 Whitechapel High Street,England,London,United Kingdom",United Kingdom,England,London,E1 7RA,,102-105 Whitechapel High Street,26/12/2020 22:22,26/12/2020 22:22,https://www.linkedin.com/company/nsi-consultancy-ltd/
