Id,Name,Location,Website,Domain,Description,Industry,EmployeeCount,Logo,EmployeeCountRange,Headquarters,Country,GeographicArea,City,PostalCode,AddressLine2,AddressLine1,Created,Modified,PublicProfileUrl
9777050,GEA Greater China,"Shanghai, Guangdong, China",http://www.gea.com,gea.com,"GEA Greater China    GEA is one of the largest suppliers of technology for the food processing industry and for a wide range of other process industries. As an international technology group, the Company focuses on world-leading process technology and components for sophisticated production processes.      In 2015, GEA generated consolidated revenues in excess of EUR 4.6 billion, more than 70 percent of which came from the food sector, which is a long-term growth industry.     The group employed about 17,500 people worldwide as of December 31, 2015. GEA is a market and technology leader in its two business areas of Equipment and Solutions. The company is listed on Germany’s MDAX stock index (G1A, WKN 660 200), on the STOXX® Europe 600 Index and a constituent of one of the MSCI Global Sustainability Indices. In addition GEA has a sponsored level I ADR program in the USA.    GEA China headquarter is located in Shanghai, China. GEA China has set up several production bases in Shanghai, Beijing, Tianjin, Shijiazhuang and Suzhou, etc. In 2015, the GEA China employed about 1,500 people who generated revenue of more than EUR 460 million. GEA China has widely recognized as the most reliable business partner for its dedication to provide best equipment and solutions to its customers, such as Dairy, Farming, Beverage, Food, Pharma, Chemical, Energy, Utilities, Marine, Land-transportation, Leisure and sports, and many other industries.    GEA China dedicates to cooperation with our customers on its best to achieve the target of sustainable development with its optimized product groups, innovative solutions and sophisticated and timely after-sales service.    GEA – engineering for a better world",Mechanical or Industrial Engineering,29,,1001-5000,"No.99, Hexiang Rd., Minhang Dist.,Shanghai,Shanghai,China",China,Shanghai,Shanghai,201109,,"No.99, Hexiang Rd., Minhang Dist.",24/12/2018 10:32,18/08/2020 16:22,https://www.linkedin.com/company/gea-greater-china/
10021591,Mercedes-Benz Korea,"Seoul, South Korea",http://www.daimler.com/career,daimler.com,"Our claim is to develop the safest, most comfortable and most efficient vehicles in the world for our customers and to manufacture them in top quality in our worldwide manufacturing plants. We adapt the design and specification of our vehicles as needed to specific customer requirements in different markets.  At the same time, we continue to conduct research that underpins our claim to leadership in the automotive industry with constantly new innovations. As the inventor of the automobile, Mercedes-Benz invests, for example, in the development of alternative drive systems such as electric vehicles or plug-in hybrid technology. In addition, we are advancing the research into autonomous driving cars significantly.  Further information and career opportunities can be found on:   http://www.mercedes-benz.co.kr/  http://www.daimler.com/career/",Automotive,230,https://media-exp1.licdn.com/dms/image/C510BAQGsHRXsyF-Fmg/company-logo_400_400/0/1568964073201?e=1615420800&v=beta&t=88WXsq_fuvtoch7a497r1acMrtTt835Om81KQmuV6yU,201-500,"416 Hangang-daero ,9th Fl. Seoul Square,Seoul,Jung-gu,Korea",Korea,Seoul,Jung-gu,4637,9th Fl. Seoul Square,416 Hangang-daero ,10/07/2019 12:59,05/12/2020 20:24,https://www.linkedin.com/company/mercedes-benz-korea/
10046180,TCS Business & Technology Services,"New York, Iowa, United States",https://www.tcs.com/business-and-technology-services,tcs.com,Building future-ready enterprises by leveraging digital technologies and trends to harness limitless opportunities.  TCS Business & Technology Services'​ Official Showcase Page,Information Technology and Services,113,https://media-exp1.licdn.com/dms/image/C510BAQFGkccJ5_8ACA/company-logo_400_400/0?e=1613001600&v=beta&t=FCF7bVUpfNn_7qqWcM3T3GJ_JJBEQrQfbMTy6VOfpV8,10001+,"World Financial Center,New York,United States",United States,,New York,,,World Financial Center,12/11/2020 09:03,12/11/2020 09:03,https://www.linkedin.com/company/tcs-businessandtechnology-services/
10115653,BBC Newsnight,"West End, England, United Kingdom",http://www.bbc.co.uk/newsnight,bbc.co.uk,"The BBC's flagship daily news and current affairs programme. Specializing in analysis, film reports and robust interviews, we broadcast every weeknight at 10:30pm on BBC Two in the UK.    Presented by Evan Davis, Kirsty Wark and Emily Maitlis.     Add ""Newsnight"" as a topic on the BBC News app to follow us online.    If you're in the UK, you can watch again at www.bbc.co.uk/newsnight    Subscribe to our YouTube channel for highlights and bonus videos www.youtube.com/user/BBCNewsnight    Follow us on Twitter @BBCNewsnight for the latest updates on #newsnight    And on Facebook for our best material, an early heads up on what's coming up, and to join in our debates https://www.facebook.com/bbcnewsnight",Broadcast Media,41,https://media-exp1.licdn.com/dms/image/C510BAQFClmWY9P0XeQ/company-logo_400_400/0?e=1612396800&v=beta&t=j3N1TUzqgoo1jTSOUbWKQcOWZq0UYIxNpkwmd8TzG-M,Nov-50,"Portland Place,London,United Kingdom",United Kingdom,,London,W1A 1AA,,Portland Place,16/02/2019 09:22,04/11/2020 22:43,https://www.linkedin.com/company/bbc-newsnight/
10172069,Brandeis International Business School,"Waltham, Massachusetts, United States",http://www.brandeis.edu/global,brandeis.edu,"Brandeis International Business School provides an education grounded in rigorous economic and financial theory and gives students the knowledge, skills and experiences they need to build rewarding lives as citizens and professionals in the global economy. The school is located in close proximity to Boston, Massachusetts, and is part of Brandeis University, one of the world's leading research universities.  Program Offerings Four graduate degrees:  • Master of Arts in International Economics and Finance (MA) • Master of Business Administration (MBA) • Master of Science in Finance (MSF) • Master of Business Analytics (MSBA) • PhD in International Economics and Finance (PhD)  Three dual-degree programs: • MSF/MBA • MSBA/MBA • MSF/MA  Undergraduate programs: • Business major and minor • BA/MA, BA/MBA and BA/MSBA programs",Higher Education,176,https://media-exp1.licdn.com/dms/image/C4D0BAQFzNhKSehePIA/company-logo_400_400/0?e=1609372800&v=beta&t=I0ghcxQYPjLLhPiH_6VMvMoqrCLurPNd3RMqWA0A1Xg,51-200,"415 South Street,MA,Waltham,United States",United States,MA,Waltham,2453,,415 South Street,09/11/2018 10:00,30/09/2020 16:27,https://www.linkedin.com/company/brandeisbusiness/
10174843,Samsung Strategy And Innovation Center,"Menlo Park, California, United States",http://www.samsung.com/us/ssic/,samsung.com,"At the Samsung Strategy and Innovation Center (SSIC), we discover and develop groundbreaking technologies to help people around the world lead happier, healthier, richer lives.  Founded in 2012 and led by Samsung Electronics President and Chief Strategy Officer, Young Sohn, SSIC works with entrepreneurs and strategic partners to foster disruptive technologies, invest in promising startups, and build new business lines through M&A and strategic partnerships. Our work spans across a range of technologies, including artificial intelligence, autonomous mobility, digital health, Internet of Things, cloud data infrastructure, privacy, and security.  Through our commitment to developing innovative, reliable products and services, recruiting top-tier talent, upholding the responsibilities of global citizenship, and collaborating with our partners and customers, SSIC is imagining the technologies that will reshape the world.  SSIC has offices in Menlo Park and San Jose, California, with additional locations in Paris, France; Tel Aviv, Israel; and Seoul, South Korea.",Research,1388,https://media-exp1.licdn.com/dms/image/C560BAQEEQhaDQAZdFw/company-logo_400_400/0/1603705951588?e=1617235200&v=beta&t=vOy-QA-dEuhW601A-Wu79xaNAxhUMGc6Jduc3dLot_E,10001+,"2440 Sand Hill Rd,CA,Menlo Park,United States",United States,CA,Menlo Park,94025,,2440 Sand Hill Rd,29/10/2018 19:47,30/12/2020 15:05,https://www.linkedin.com/company/samsung-strategy-and-innovation-center/
10204507,BBC Trust,"City of Westminster, England, United Kingdom",http://www.bbc.co.uk/bbctrust,bbc.co.uk,"Led by the Chairman, the Trust is made up of 12 Trustees with a wide breadth of experience. There are four National Trustees who represent England, Scotland, Wales and Northern Ireland, and there is also an International Trustee who has specific oversight of the BBC's international public services, including the World Service. All Trustees are appointed by the Queen on advice from Ministers after an open selection process.    The Trust is the sovereign body within the BBC. It is independent from the BBC’s Executive Board, which is led by the Director-General.    The Trust Unit supports Trustees by providing expert independent advice and administrative support. Staff within the Trust Unit report directly to the Trust.    The Trust is advised by four Audience Councils who advise the Trust on the interests of audiences across the UK.",Broadcast Media,5,https://media-exp1.licdn.com/dms/image/C4D0BAQFKfhNrV3PDiw/company-logo_400_400/0?e=1606953600&v=beta&t=GNOfJ59j6jSBn7FiMV0QKxVzy7-e0TWio-p9z-rQ7Ec,51-200,"180 Great Portland Street,London,United Kingdom",United Kingdom,,London,W1W 5QZ,,180 Great Portland Street,02/09/2020 14:45,02/09/2020 14:45,https://www.linkedin.com/company/bbc-trust/
10218505,Samsung Electronics Romania,"Bucharest, Bucharest, Romania",http://www.samsung.com/ro,samsung.com,"Bine ați venit pe pagina oficială Samsung Electronics România. De peste 70 de ani, suntem aici să creăm o lume mai bună şi să ducem afacerile la nivelul următor prin tehnologie. Prin produsele şi serviciile inovatoare, fiabile, prin oamenii talentaţi, prin abordarea responsabilă a afacerilor şi a poziţiei de cetăţean corporativ, prin colaborarea cu partenerii şi clienţii noştri, Samsung duce lumea în noi direcţii, pline de imaginaţie.  Descoperiţi pe www.samsung.com/ro/business/ informații în premieră despre companie, soluțiile noastre inovatoare pentru business, produse, noutăți, studii de caz și evenimentele la care puteți participa.",Electrical/Electronic Manufacturing,142,https://media-exp1.licdn.com/dms/image/C4E0BAQETjA8RbJkTAg/company-logo_400_400/0?e=1613606400&v=beta&t=LnFHs4n2HYNkLZiGCuR9D7gWBNksAa6w2GGJpP9TBPk,10001+,"Wllbrook Platinum Center, Sos. Bucuresti - Ploiesti, nr 172-176,Romania,București,Romania",Romania,Romania,București,13686,,"Wllbrook Platinum Center, Sos. Bucuresti - Ploiesti, nr 172-176",13/03/2020 12:24,17/11/2020 12:45,https://www.linkedin.com/company/samsung-business-romania/
10261221,Samsung Southeast Asia And Oceania,"Singapore, Singapore",http://www.samsung.com/business,samsung.com,"Welcome to Samsung Business Southeast Asia and Oceania.  From the heart of Asia to the rest of the world, Samsung is opening new possibilities for businesses and building partnerships. Driven by our Asian heritage, determination and approach to business and global citizenship and collaboration with our partners and customers, we are transforming the world through the perspective of relentless discoveries, innovation for all and solutions across our products, services and people.  Through the journey of the Internet of Things through, among other things, our Smart Home and Digital Health initiatives; we are taking the world in imaginative new directions and creating possibilities starting with you.  We are your neighbours in Asia and present in Australia, Brunei, Cambodia, Indonesia, Laos, Malaysia, Myanmar, New Zealand, Philippines, Singapore, Taiwan, Thailand and Vietnam.  Samsung Business SEAsia Oceania LinkedIn is operated by Samsung Asia Pte Ltd (“SAPL”) and you can contact SAPL by leaving a comment in any of our posts. For more information, please visit http://www.samsung.com/sg/business/legal/",Consumer Electronics,22,https://media-exp1.licdn.com/dms/image/C510BAQEUBQWuYlo-EA/company-logo_400_400/0?e=1610582400&v=beta&t=TObBQXQkvP725J5Ruh4-_TF6lYuKunACuCMlFiHgdvA,501-1000,"Mapletree Business City 30 Pasir Panjang Road #17-31/32,Singapore,Singapore,Singapore",Singapore,Singapore,Singapore,117440,,Mapletree Business City 30 Pasir Panjang Road #17-31/32,14/10/2020 17:27,14/10/2020 17:27,https://www.linkedin.com/company/samsung-b2b-seasia-oceania/
10310718,Accenture Southeast Asia,"Kuala Lumpur, Federal Territory of Kuala Lumpur, Malaysia",https://www.accenture.com/,accenture.com,"Accenture is a global professional services company, providing a broad range of services and solutions in strategy, consulting, digital, technology and operations. We work at the intersection of business and technology to help clients improve their performance and create sustainable value for their stakeholders. Accenture ASEAN comprises Indonesia, Malaysia, Singapore and Thailand.",Information Technology and Services,263,https://media-exp1.licdn.com/dms/image/C510BAQGESJ2JQ_eVjA/company-logo_400_400/0?e=1606953600&v=beta&t=W4kF9O0uU1cZksxTQN7MxKbaScswY9dqAd6YTxPygJc,10001+,"The Gardens North Tower, 35,Lingkaran Syed Putra, Mid Valley City,Thailand,Malaysia, Singapore, Indonesia,Malaysia",Malaysia,Thailand,"Malaysia, Singapore, Indonesia",59200,"Lingkaran Syed Putra, Mid Valley City","The Gardens North Tower, 35",05/02/2019 13:57,28/08/2020 16:01,https://www.linkedin.com/company/accenture-sea/
10332319,Accenture In The Philippines,,http://www.accenture.com/ph-en/new-applied-now,accenture.com,"Accenture is a leading global professional services company, providing a broad range of services and solutions in strategy, consulting, digital, technology and operations. Combining unmatched experience and specialized skills across more than 40 industries and all business functions—underpinned by the world’s largest delivery network—Accenture works at the intersection of business and technology to help clients improve their performance and create sustainable value for their stakeholders. With 477,000 people serving clients in more than 120 countries, Accenture drives innovation to improve the way the world works and lives. Visit us at www.accenture.com.   Awards International ICT Awards Best Employer of the Year (2019) Best Employer of the Year (2017) Hall of Fame – Best Company of the Year (2015) Best Company of the Year ( 2014) BPO Company of the Year (2012) BPO Employer of the Year (2008) BPO Company of the Year (2007)  JobStreet.com Philippines Awards Recognized as one of JobStreet.com Philippines’ “Top 10 Most Aspired Companies Filipinos Would Like to Work For” (2015, 2016, and 2017)  Economic Dividends for Gender Equality (EDGE) First company in the Philippines to receive the EDGE Move Certification for Gender Equality (2018)  PEZA (Philippine Economic Zone Authority) Hall of Fame for Outstanding Community Project Award (2017) Outstanding Exporter Award (2008, 2009, & 2010) Hall of Fame Award for Outstanding Exporter Award (2011) Outstanding Employer Award (2008, 2012, & 2013) Hall of Fame Award for Outstanding Employer Award (2014) Outstanding Community Project Award (2010, 2015)",Information Technology and Services,378,https://media-exp1.licdn.com/dms/image/C560BAQHCDDK-F2wsRQ/company-logo_400_400/0?e=1597881600&v=beta&t=Pz08cnhjEJi-9XQD-41a9tXRG5FVnZu7_gd_mY2Nifc,10001+,,,,,,,,16/05/2020 12:26,16/05/2020 12:26,https://www.linkedin.com/company/accenture_in_the_philippines/
10332849,Samsung Electronics Polska,"Warsaw, Mazowieckie, Poland",http://www.samsung.com/pl/business/,samsung.com,"Samsung Electronics Polska to światowy lider w dostarczaniu nowoczesnych technologii cyfrowych wspierających biznes.   Nieustannie ulepszamy Digital Signage, kanał sprzedaży profesjonalnych systemów wizualnych dla rozwojowych branż. Oferujemy innowacyjne produkty dynamizujące biznes, a także pokazujemy, jak wprowadzić do firm nowoczesne rozwiązania z zakresu technologii cyfrowej.  Firmom z sektora Logistyki i transportu proponujemy m.in. cyfrowy terminal oraz urządzenia przenośne zwiększające wygodę i mobilność pracowników, usprawniające obsługę klienta, a także podnoszące komfort podróży.   Branży hotelarskiej dedykujemy serię telewizorów hotelowych wraz z rozwiązaniem umożliwiającym zarządzanie kanałami i treścią, aplikacje na urządzenia przenośne (informujące o promocjach i usługach), klimatyzatory systemowe i ekrany z innowacyjnym rozwiązaniem MagicInfo. Rozwiązania te zapewniają kompleksową obsługę gości, pełną automatyzację oraz usprawniają pracę hotelu na wielu poziomach.  Firmom z sektora Finansów i bankowości oraz Retailu przydatne będą m.in. monitory profesjonalne, tablety Galaxy, a także najnowocześniejsza ścianka z paneli LED, czyli innowacyjne rozwiązanie do prezentowania informacji.  Przygotowaliśmy też nowatorskie rozwiązania dla Edukacji, m.in. możliwość stworzenia inteligentnej sali lekcyjnej dzięki monitorom interaktywnym, materiałom edukacyjnym czy tabletom Galaxy.   W Instytucjach rządowych przydatne są nowoczesne rozwiązania jak tablety, smartfony, płaskie monitory wielkoformatowe, zegarki Smart. Podnoszą jakość usług publicznych oraz działań obronnych.  Jak przetwarzamy Twoje dane: https://www.samsung.com/pl/info/privacy/RODO/  Masz pytania? Podziel się nimi na forum: http://spr.ly/spolecznosc_samsung",Electrical/Electronic Manufacturing,959,https://media-exp1.licdn.com/dms/image/C4D0BAQG_bX2ioBoeuw/company-logo_400_400/0?e=1611187200&v=beta&t=NgRxlFiJCLYrROWL1GiE7ex34vM5F30bWHjGgJ58q3Y,201-500,"Postępu 14,Warszawa,Poland",Poland,,Warszawa,02-676,,Postępu 14,10/12/2018 12:16,21/10/2020 09:26,https://www.linkedin.com/company/samsungpolska/
10336242,Accenture Colombia,"Bogotá, San Andrés and Providencia, Colombia",https://www.accenture.com/co-es,accenture.com,"En Accenture nos levantamos todos los días para mejorar la forma en que las personas viven y trabajan. Liderando la transformación digital de Colombia y el mundo.   Llevamos 14 años consecutivos dentro del Fortune World’s Most Admired Companies, y este es nuestro tercer año como la agencia digital más grande del mundo (Accenture Interactive). Contamos con un equipo de más de 500.000 colaboradores en 120 países del mundo, responsables de proteger más del 25% del tráfico mundial de internet, procesar 300 millones de pasajes aéreos al año y el 70% del correo en el mundo, entre otros valiosos aportes a la sociedad.   Nos enorgullece ser la empresa más inclusiva y diversa del mundo (RANKING DE EQUIDAD DE GÉNERO PAR-AEQUALES) Empoderamos mujeres, personas en situación vulnerable y con discapacidad; brindándoles capacitación y la oportunidad de realizar sus sueños a través del trabajo.   Síguenos y conoce nuestras ofertas laborales y todas las tendencias que están cambiando el mundo gracias a la tecnología y la innovación. ",Management Consulting,262,https://media-exp1.licdn.com/dms/image/C4E0BAQG-7p3EP-As9g/company-logo_400_400/0?e=1609977600&v=beta&t=rjwYKg_Fc4uo_qJocrteN1L3yuRyBn_zKyDphlQlaa4,10001+,"Carrera 7 #71-52 ,Torre A. Piso 10,Bogotá,Bogotá,Colombia",Colombia,Bogotá,Bogotá,0,Torre A. Piso 10,Carrera 7 #71-52 ,02/10/2020 17:27,02/10/2020 17:27,https://www.linkedin.com/company/accenture-colombia/
10338149,Accenture Chile,"Las Condes, Región Metropolitana de Santiago, Chile",http://www.accenture.com/cl-es,accenture.com,"Accenture es una compañía global de servicios profesionales que provee una amplia gama de servicios y soluciones en estrategia, consultoría, desarrollos digitales, tecnología y operaciones. Combinando una experiencia inigualable y conocimientos especializados en más de 40 industrias y en todas las funciones de negocios ―respaldada por la red de distribución más grande del mundo― Accenture trabaja en la intersección entre los negocios y la tecnología para ayudar a sus clientes a mejorar su desempeño y crear valor sostenible para sus grupos de interés. Con más de 373.000 empleados que atienden a sus clientes en más de 120 países, Accenture impulsa la innovación para mejorar la forma en que el mundo trabaja y vive. Visítenos en www.accenture.cl",Consultoría de estrategia y operaciones,354,https://media-exp1.licdn.com/dms/image/C4D0BAQH3Rxs1MSYosg/company-logo_400_400/0?e=1606348800&v=beta&t=PepEJp_hWaeTuaRzOs2pqL3qwJeGilNFfX2iSzJ7cJU,10001+,"Avenida Apoquindo 5550,Santiago Metropolitan,Las Condes,Chile",Chile,Santiago Metropolitan,Las Condes,7550000,,Avenida Apoquindo 5550,02/04/2020 10:48,25/08/2020 13:09,https://www.linkedin.com/company/accenture-chile/
10361310,Accenture Research,"New York, Iowa, United States",http://Accenture.com/research,accenture.com,"Accenture Research identifies and anticipates game-changing business, market and technology trends through provocative thought leadership. Our 300 researchers partner with world-class organizations such as MIT and HBS to discover innovative solutions for our clients.",Information Technology and Services,152,https://media-exp1.licdn.com/dms/image/C4D0BAQHbp1jGgSXd3g/company-logo_400_400/0/1604426570592?e=1614211200&v=beta&t=bcwgulcQ68NH1rWnYPISnb-JwB47z_Wh8oQE1EUv5TI,10001+,"1345 Avenue of the Americas,New York,United States",United States,,New York,,,1345 Avenue of the Americas,11/05/2020 15:17,20/11/2020 07:59,https://www.linkedin.com/company/accenture_research/
10593208,Accenture Software For HCM,"Heidelberg, Baden-Württemberg, Germany",http://www.accenture.com/hcmsoftware,accenture.com,"As organizations embrace human capital management systems to help them manage their people, they often seek ways to automate and increase productivity. Combining experience and knowledge about how to optimize HR processes, Accenture Software for Human Capital Management offers a suite of software solutions that helps HR business processes work more efficiently and effectively. Use our innovative solutions, whether on-premise or in the cloud, for:   • testing, migration and consolidation  • document life cycle  • interface and connectivity  • data quality, auditing and visualization    Get to know us better:  Tweet with us: https://twitter.com/accenture_hcm   E-mail hcmsoftwaresales@accenture.com",Information Technology and Services,38,https://media-exp1.licdn.com/dms/image/C4D0BAQHOfZJBCHFHqQ/company-logo_400_400/0?e=1605139200&v=beta&t=wIXyzkdq5ms6R4QX90sCiDXUYGjTZ10xzKA3Njz27rg,501-1000,"Im Breitspiel 5,Baden-Württemberg,Heidelberg,Germany",Germany,Baden-Württemberg,Heidelberg,69126,,Im Breitspiel 5,21/08/2019 15:20,11/08/2020 23:58,https://www.linkedin.com/company/accenture_software_for_human_capital_management/
10633911,Samsung Saudi Arabia,"Jiddah, Makkah, Saudi Arabia",http://samsung.com/sa/business/,samsung.com,"Welcome to Samsung.     For over 70 years, Samsung has been dedicated to making a better world through diverse businesses that today span advanced technology, semiconductors, skyscraper and plant construction, petrochemicals, fashion, medicine, finance, hotels and more. Our flagship company, Samsung Electronics, leads the global market in high-tech electronics manufacturing and digital media.    Through innovative, reliable products and services; talented people; a responsible approach to business and global citizenship; and collaboration with our partners and customers, Samsung is taking the world in imaginative new directions.",Electrical/Electronic Manufacturing,159,https://media-exp1.licdn.com/dms/image/C510BAQEqXHVGwEjMWQ/company-logo_400_400/0?e=1614816000&v=beta&t=QD_dKA4ZO8eL_xo4bSYsWIqFVvfWu2gXs_Def5R3wMo,501-1000,"Madinah Road,Saudi Arabia,Jeddah ,Saudi Arabia",Saudi Arabia,Saudi Arabia,Jeddah ,21577,,Madinah Road,02/12/2020 19:08,02/12/2020 19:08,https://www.linkedin.com/company/samsungsaudi/
10638340,Thales Portugal,"Oeiras, Lisboa, Portugal",https://www.thalesgroup.com/en/countries/europe/portugal,thalesgroup.com,"Thales Portugal is a Competence Centre of the Thales Group, whose mission is to integrate and develop solutions and products for Thales projects worldwide. Having around 220 specialized human resources Thales Portugal has a strong capability to design, develop, and deploy systems and services efficiently in the Defence, Security (Critical Information Systems, Critical Infrastructure and Banking) and Transportation markets.",Telecomunicações,150,https://media-exp1.licdn.com/dms/image/C560BAQEMgp7zms-kpg/company-logo_400_400/0?e=1614211200&v=beta&t=I53UCiUKGJSVHPFHhwKEIG8wqOT91KmSyKrWO-_ih_Y,201-500,"Rua Calvet Magalhães, 245,Paço de Arcos,Oeiras,Portugal",Portugal,Paço de Arcos,Oeiras,2770-153,,"Rua Calvet Magalhães, 245",14/08/2018 14:09,26/11/2020 01:42,https://www.linkedin.com/company/thales-portugal/
