Id,Name,Location,Website,Domain,Description,Industry,EmployeeCount,Logo,EmployeeCountRange,Headquarters,Country,GeographicArea,City,PostalCode,AddressLine2,AddressLine1,Created,Modified,PublicProfileUrl
1009,IBM,"Armonk, New York, United States",http://www.ibm.com,ibm.com,"At IBM, work is more than a job - it's a calling: To build. To design. To code. To consult. To think along with clients and sell. To make markets. To invent. To collaborate. Not just to do something better, but to attempt things you've never thought possible. To lead in this new era of technology and solve some of the world's most challenging problems.   IBM is a leading cloud platform and cognitive solutions company. Restlessly reinventing since 1911, we are the largest technology and consulting employer in the world, with more than 350,000 employees serving clients in 170 countries. With Watson, the AI platform for business, powered by data, we are building industry-based solutions to real-world problems. For more than seven decades, IBM Research has defined the future of information technology with more than 3,000 researchers in 12 labs located across six continents. For more information, visit www.ibm.com.   This is IBM's official LinkedIn account and it follows IBM Social Computing Guidelines. We reserve the right to delete comments that are offensive or suggestive, personal attacks, anonymous, wildly off-topic, spam or advertisements. For more information regarding IBM’s social computing guidelines, visit http://ibm.co/1LRDq6F",Information Technology and Services,502472,https://media-exp1.licdn.com/dms/image/C4E0BAQGfKOtAsJ7gOQ/company-logo_400_400/0?e=1613001600&v=beta&t=CcvAaVckOl_jkTBEYE3-JlgYaNX8FbM15tVWDALU5lI,10001+,"International Business Machines Corp.,New Orchard Road,NY,Armonk, New York,United States",United States,NY,"Armonk, New York",10504,New Orchard Road,International Business Machines Corp.,09/08/2018 10:29,12/11/2020 13:37,https://www.linkedin.com/company/ibm/
1033,Accenture,"Dublin2, County Dublin, Ireland",http://www.accenture.com,accenture.com,"Accenture is a global professional services company with leading capabilities in digital, cloud and security. Combining unmatched experience and specialized skills across more than 40 industries, we offer Strategy and Consulting, Interactive, Technology and Operations services—all powered by the world’s largest network of Advanced Technology and Intelligent Operations centers. Our 500,000+ people deliver on the promise of technology and human ingenuity every day, serving clients in more than 120 countries. We embrace the power of change to create value and shared success for our clients, people, shareholders, partners and communities. Visit us at www.accenture.com. ",Information Technology and Services,379905,https://media-exp1.licdn.com/dms/image/C4D0BAQFQBiOApKUGnA/company-logo_400_400/0?e=1613001600&v=beta&t=v5842hfIvQsL_MQXHVB9WZ5m7o7iQASxNmcEnPN7QeM,10001+,"Grand Canal Harbour,Dublin 2,Ireland",Ireland,,Dublin 2,,,Grand Canal Harbour,09/08/2018 09:47,12/11/2020 15:32,https://www.linkedin.com/company/accenture/
1052,AT&T,"Dallas, Texas, United States",http://www.att.com,att.com,"We understand that our customers want an easier, less complicated life.     We’re using our network, labs, products, services and people to create a world where everything works together seamlessly, and life is better as a result.  How will we continue to drive for this excellence in innovation?   With you.   Our people, and their passion to succeed, are at the heart of what we do. Today, we’re poised to connect millions of people with their world, delivering the human benefits of technology in ways that defy the imaginable.   What are you dreaming of doing with your career?    Find stories about our talent, career advice, opportunities, company news, and innovations here on LinkedIn.   To learn more about joining AT&T, visit: http://www.att.jobs   To explore AT&T Labs, Foundry, and more, visit: https://www.linkedin.com/company/at&tinnovation   To follow AT&T Small Business community, visit: https://bizcircle.att.com  We provide in some of our posts links to articles or posts from third-party websites unaffiliated with AT&T.  In doing so, AT&T is not adopting, endorsing or otherwise approving the content of those articles or posts.  AT&T is providing this content for your information only.",Telecommunications,240031,https://media-exp1.licdn.com/dms/image/C560BAQE6Wr9RUG3OuA/company-logo_400_400/0?e=1613606400&v=beta&t=pbDoSDoQLsWi_seh2r2cHh_bwBNe16ZQCSdQ91vHzWw,10001+,"208 S. Akard Street,TX,Dallas,United States",United States,TX,Dallas,75202,,208 S. Akard Street,09/08/2018 10:13,13/11/2020 12:47,https://www.linkedin.com/company/att/
1075,Capgemini Invent,"Paris, Île-de-France, France",http://www.capgemini.com/invent,capgemini.com,"Capgemini Invent is the digital innovation, consulting and transformation brand of the Capgemini Group, a global business line that combines market leading expertise in strategy, technology, data science and creative design, to help CxOs envision and build what’s next for their businesses.  For more information: http://www.capgemini.com/invent.  Follow us on Twitter @CapgeminiInvent.",Management Consulting,12722,https://media-exp1.licdn.com/dms/image/C4D0BAQHtBOmKmj6BNg/company-logo_400_400/0?e=1614211200&v=beta&t=qhZJEyqwf7Oob-iNMZ5PZvp6rATPtZAWVat7l2l_Clk,5001-10000,"Place de l'Etoile, 11 rue de Tilsitt,Paris,France",France,,Paris,75017,,"Place de l'Etoile, 11 rue de Tilsitt",13/08/2018 11:04,20/11/2020 11:38,https://www.linkedin.com/company/capgemini-invent/
1116,Procter & Gamble,"Cincinnati, Ohio, United States",http://www.pg.com,pg.com,"P&G was founded over 180 years ago as a soap and candle company. Today, we’re the world’s largest consumer goods company and home to iconic, trusted brands, including Always®, Charmin®, Braun®, Fairy®, Febreze®, Gillette®, Head & Shoulders®, Oral B®, Pantene®, Pampers®, Tide®, and Vicks®.   The design, development, growth and success of these products—and many more—is thanks to the innovative and insightful minds of our people. From Day 1, you’ll help make everyday life easier for our 5 billion consumers through billion dollar brands. With our large global footprint, there are many opportunities to work with P&G in multiple locations.   We offer opportunities in approximately 70 countries and continually aim to attract, reward and advance the finest people in the world. As a ""build from within""​ organization, we see 95% of our people start at an entry level and progress through the organization. Here, we want you to get your career off to a fast start. That's why we don't have any rotational development programs or gradual ramping-up periods: you’ll be able—and encouraged—to dive right in from day 1.  Join us and help make life better through meaningful work that makes an impact from Day 1.  ",Consumer Goods,108068,https://media-exp1.licdn.com/dms/image/C4E0BAQEeKlNx4roCPw/company-logo_400_400/0?e=1613606400&v=beta&t=Hqlm3jerUbXMKuaO8cTwWpXyledp4le30vq4jqe18Io,10001+,"2 P&G Plaza,Ohio,Cincinnati,United States",United States,Ohio,Cincinnati,45202,,2 P&G Plaza,09/08/2018 19:25,14/11/2020 12:03,https://www.linkedin.com/company/procter-and-gamble/
1352,Morgan Stanley Investment Management,,http://www.morganstanley.com/im/,morganstanley.com,"Morgan Stanley Investment Management, together with its investment advisory affiliates, has more than 645 investment professionals around the world and strives to provide outstanding long-term investment performance, service and a comprehensive suite of investment management solutions to a diverse client base, which includes governments, institutions, corporations and individuals worldwide. For further information about Morgan Stanley Investment Management, please visit www.morganstanley.com/im.  CRC 2291444 Exp. 10/31/2019",Investment Management,12,,10001+,,Other,,,,,,12/11/2019 10:28,12/11/2019 10:28,
1612,Abbott,"North Chicago, Illinois, United States",https://www.abbott.com,abbott.com,"Abbott is a global healthcare leader that helps people live more fully at all stages of life. Our portfolio of life-changing technologies spans the spectrum of healthcare, with leading businesses and products in diagnostics, medical devices, nutritionals and branded generic medicines. Our 107,000 colleagues serve people in more than 160 countries.   Connect with us at www.abbott.com, on Facebook at www.facebook.com/Abbott and www.facebook.com/AbbottCareers, on Instagram @AbbottGlobal, and on Twitter @AbbottNews and @AbbottGlobal.  We invite you to explore opportunities at Abbott, to see if your talents and career aspirations may fit with our openings. An equal opportunity employer, Abbott welcomes and encourages diversity in our workforce.",Hospital & Health Care,84643,https://media-exp1.licdn.com/dms/image/C4E0BAQH5ihBvHQeuow/company-logo_400_400/0?e=1613606400&v=beta&t=CdoDF153i9nHu0tI7tDCEwISDnDmiTe0GrUsi5nzMV8,10001+,"100 Abbott Park Road,Illinois,Abbott Park,United States",United States,Illinois,Abbott Park,60064-3500,,100 Abbott Park Road,09/08/2018 10:18,16/11/2020 07:31,https://www.linkedin.com/company/abbott-/
1753,Samsung Electronics,South Korea,http://www.samsung.com,samsung.com,"Samsung Electronics is a global leader in technology, opening new possibilities for people everywhere. Through relentless innovation and discovery, we are transforming the worlds of TVs, smartphones, wearable devices, tablets, digital appliances, network systems, medical devices, semiconductors and LED solutions. Samsung is also leading in the Internet of Things space through, among others, our Smart Home and Digital Health initiatives.   Since being established in 1969, Samsung Electronics has grown into one of the world’s leading technology companies, and become recognized as one of the top 10 global brands. Our network now extends across the world, and Samsung takes great pride in the creativity and diversity of its talented people, who drive our growth.  To discover more, please visit our website at www.samsung.com and our official newsroom at news.samsung.com",Consumer Electronics,103428,https://media-exp1.licdn.com/dms/image/C560BAQEiexDt2WV9qg/company-logo_400_400/0?e=1613606400&v=beta&t=f4eaX7S2QrjXlvaMXeMocK8wRptpSuud7RX4B8206yA,10001+,"129 Samsung-ro,Gyeonggi-Do,Suwon-Si,Korea",Korea,Gyeonggi-Do,Suwon-Si,443-742,,129 Samsung-ro,09/08/2018 10:26,15/11/2020 21:13,https://www.linkedin.com/company/samsung-electronics/
1762,BBC,"London, England, United Kingdom",http://www.bbc.co.uk/careers/,bbc.co.uk,"The BBC is the world’s leading public service broadcaster.  We’re impartial and independent, and every day we create distinctive, world-class programmes and content which inform, educate and entertain millions of people in the UK and around the world.  We do this across: - A portfolio of television services, including the UK’s most-watched channel BBC One, the pioneering online-only youth service BBC Three, and our multi award-winning channels for children, as well as national and regional television programmes and services across England. Northern Ireland, Scotland and Wales - Ten UK-wide radio networks, providing the best live music broadcasting in the UK, as well as speech radio which informs, educates and entertains. We also have two national radio services each in Scotland, Wales and Northern Ireland and 39 local radio stations across England and the Channel Islands, providing an invaluable and unique service to listeners across the UK - Our digital services including BBC News, Sport, Weather CBBC and CBeebies, iPlayer and BBC Sounds, BBC Red Button and our vast archive - BBC World Service television, radio and online on more than 40 languages  ",Broadcast Media,20585,https://media-exp1.licdn.com/dms/image/C4D0BAQEKMnFzo3rIIw/company-logo_400_400/0?e=1613606400&v=beta&t=WjJASSJH7Ki5GZPavuOzjZsr120R-PKxKbJB_TUNSYw,10001+,"Portland Place,England,London,United Kingdom",United Kingdom,England,London,,,Portland Place,09/08/2018 19:27,15/11/2020 08:34,https://www.linkedin.com/company/bbc/
1951,Thales,France,http://www.thalesgroup.com/,thalesgroup.com,"Thales is a global high technology leader investing in digital and “deep tech” innovations – connectivity, big data, artificial intelligence, cybersecurity and quantum technology – to build a future we can all trust, which is vital to the development of our societies. The company provides solutions, services and products that help its customers – businesses, organisations and states – in the defence, aeronautics, space, transportation and digital identity and security markets to fulfil their critical missions, by placing humans at the heart of the decision-making process.",Information Technology and Services,48646,https://media-exp1.licdn.com/dms/image/C4D0BAQEmnUAXTuLkJQ/company-logo_400_400/0?e=1613606400&v=beta&t=AoOVzWh29UML_1pUCoUI8a0dEhSOp4oCWEboi_nS6tc,10001+,"Tour Carpe Diem,31 Place des Corolles – CS 20001,92098 PARIS LA DEFENSE Cedex,France",France,,92098 PARIS LA DEFENSE Cedex,,31 Place des Corolles – CS 20001,Tour Carpe Diem,09/08/2018 09:59,13/11/2020 11:54,https://www.linkedin.com/company/thales/
2459,Zurich North America,"Schaumburg, Illinois, United States",http://www.zurichna.com,zurichna.com,"Zurich North America is one of the largest providers of insurance solutions and services to businesses and individuals. Our customers represent industries ranging from agriculture to construction and include more than 90% of the Fortune 500. We’ve backed the building of some of the most recognizable structures in North America — from the Hoover Dam to Madison Square Garden to the Confederation Bridge. Our North American, LEED Platinum® headquarters is located in the Chicago area. We employ approximately 9,000 people in North America and have offices throughout the U.S. and Canada. Further information is available at www.zurichna.com.  Zurich North America is part of Zurich Insurance Group, a leading multi-line insurer that serves its customers in global and local markets. With approximately 55,000 employees, Zurich provides a wide range of property and casualty, and life insurance products and services in more than 215 countries and territories. Zurich’s customers include individuals, small businesses, and mid-sized and large companies, as well as multinational corporations. The Group is headquartered in Zurich, Switzerland, where it was founded in 1872. The holding company, Zurich Insurance Group Ltd (ZURN), is listed on the SIX Swiss Exchange and has a level I American Depositary Receipt (ZURVY) program, which is traded over-the-counter on OTCQX. Further information is available at www.zurich.com.   Follow Zurich North America on Twitter: http://twitter.com/#!/zurichna  Please be respectful of all commenters on the site. Any comments that contain vulgar language, name calling, personal attacks or are off topic are not allowed and will be deleted. Also spam and/or advertisements will also be removed. We reserve the right to review and delete any posts or comments, or report users if they violate Zurich North America's Rules of Conduct or LinkedIn's Terms of Service.  Zurich North America's Rules of Conduct: https://bit.ly/3081nQB",Insurance,7213,https://media-exp1.licdn.com/dms/image/C4E0BAQESFnLnnoBACw/company-logo_400_400/0/1593616521388?e=1616630400&v=beta&t=VCO7d1Wi54MOqIBe2VIJliUnFdIGrONDigdk9rFj3k4,10001+,"1299 Zurich Way,IL,Schaumburg,United States",United States,IL,Schaumburg,60196,,1299 Zurich Way,20/08/2018 12:02,18/12/2020 12:00,https://www.linkedin.com/company/zurich-north-america/
2683,Gemalto (Now Thales Digital Identity & Security),"Vannes, Brittany, France",https://www.thalesgroup.com/en/markets/digital-identity-and-security,thalesgroup.com,"Thales Digital Identity & Security is a global leader in digital security, bringing trust to an increasingly connected world. We design and deliver a wide range of products, software and services based on two core technologies: digital identification and data protection. Our technology is at the heart of modern life, from payment to enterprise security and the internet of things. It enables our clients to deliver secure digital services for billions of individuals and things. We are part of the Thales group, a €19bn international organization with more than 80,000 employees in 68 countries worldwide. ",Information Technology and Services,6873,https://media-exp1.licdn.com/dms/image/C560BAQHRBaYLFLGchA/company-logo_400_400/0/1587888254188?e=1614211200&v=beta&t=lltvSy2LIU0dcgXpUs9BTaYjozlorvhLqkHTcZohYMI,10001+,"6 rue de la Verrerie,Meudon,France",France,,Meudon,92197,,6 rue de la Verrerie,10/08/2018 17:19,20/11/2020 16:13,https://www.linkedin.com/company/gemalto/
2814,Aramark Healthcare,"Philadelphia, Pennsylvania, United States",http://www.aramark.com/healthcare,aramark.com,"Aramark's Healthcare team provides best-in-class support services that are essential to healthcare delivery.      Understanding that clinical excellence and the environment are interdependent, Aramark directly impacts the entire healthcare continuum – patient, employee, nurse and physician satisfaction, operational efficiency and service excellence.      Through its food, facility, and clinical technology services, Aramark helps more than 1,000 hospitals and senior living facilities deliver the optimal experience for patients and residents, their families, and the physicians, nurses and staff who care for them.",Hospital & Health Care,4145,https://media-exp1.licdn.com/dms/image/C560BAQGa3H6olMcnfQ/company-logo_400_400/0?e=1609977600&v=beta&t=qt2_V0l2bb8ze4WeuKOikWRuTolUWsT5wBWKB3ZBANI,10001+,"1101 Market Street,PA,Philadelphia,United States",United States,PA,Philadelphia,19107,,1101 Market Street,20/08/2018 10:35,07/10/2020 18:02,https://www.linkedin.com/company/aramark-healthcare/
2815,Aramark,"Philadelphia, Pennsylvania, United States",http://www.aramark.com,aramark.com,"We deliver experiences that enrich and nourish people’s lives through innovative services in food, facilities management, and uniforms. United by a passion to serve, our more than 270,000 employees make a meaningful difference each day for millions of people in 19 countries around the world. We are recognized as one of the World’s Most Admired Companies by FORTUNE, rated number one among Diversified Outsourcing Companies, as well as an employer of choice by the Human Rights Campaign and DiversityInc.",Retail,33746,https://media-exp1.licdn.com/dms/image/C4E0BAQHj_X7yjMiJhw/company-logo_400_400/0/1589548715993?e=1614211200&v=beta&t=NCgbhykcgc3BNC657ANJx4_KxG-_kstD5eOOoggxh9w,10001+,"2400 Market St,Pennsylvania,Philadelphia,United States",United States,Pennsylvania,Philadelphia,19103,,2400 Market St,16/08/2018 22:56,26/11/2020 15:24,https://www.linkedin.com/company/aramark/
2861,Life Technologies,"Waltham, Massachusetts, United States",http://www.thermofisher.com/,thermofisher.com,"Life Technologies is now part of Thermo Fisher Scientific. To see what’s new, go to https://www.linkedin.com/company/thermo-fisher-scientific    Thermo Fisher Scientific Inc. (NYSE: TMO) is the world leader in serving science, with revenues of $17 billion and approximately 50,000 employees in 50 countries. Our mission is to enable our customers to make the world healthier, cleaner and safer. We help our customers accelerate life sciences research, solve complex analytical challenges, improve patient diagnostics and increase laboratory productivity. Through our premier brands – Thermo Scientific, Applied Biosystems, Invitrogen, Fisher Scientific and Unity Lab Services – we offer an unmatched combination of innovative technologies, purchasing convenience and comprehensive support. For more information, please visit www.thermofisher.com.",Biotechnology,4286,https://media-exp1.licdn.com/dms/image/C4E0BAQGnGeodjQKFaA/company-logo_400_400/0/1519855866331?e=1616025600&v=beta&t=xwLF7gzHUHeiVf0bRjTNDc7MsZv9kctDqbcnH-KyU6I,10001+,"81 Wyman Street,MA,Waltham,United States",United States,MA,Waltham,,,81 Wyman Street,20/08/2018 10:01,16/12/2020 16:18,https://www.linkedin.com/company/life_technologies/
2873,Banco Santander,"Boadilla del Monte, Comunidade de Madrid, Espanha",https://www.santander.com,santander.com,"O Banco Santander (SAN.MC, STD.N, BNC.LN) é um banco comercial com sede na Espanha e cotas de mercado relevantes em 10 mercados-chave da Europa e da América.  ",Bancos,63739,https://media-exp1.licdn.com/dms/image/C4E0BAQG6KCo_TUxc7g/company-logo_400_400/0?e=1613606400&v=beta&t=mKiqbSlHasrcBP-aM8mLUXlLxwaH0HxSgCEwVLHiM0o,10001+,"Avenida de Cantabria S/N,Madrid,Boadilla del Monte,Espanha",Espanha,Madrid,Boadilla del Monte,28660,,Avenida de Cantabria S/N,09/08/2018 10:27,16/11/2020 16:47,https://www.linkedin.com/company/banco-santander/
3081,Thermo Fisher Scientific,"Waltham, Massachusetts, United States",https://www.thermofisher.com,thermofisher.com,"Thermo Fisher Scientific Inc. (NYSE: TMO) is the world leader in serving science, with revenues of more than $24 billion and approximately 70,000 employees globally. Our mission is to enable our customers to make the world healthier, cleaner and safer. We help our customers accelerate life sciences research, solve complex analytical challenges, improve patient diagnostics, deliver medicines to market and increase laboratory productivity. Through our premier brands – Thermo Scientific, Applied Biosystems, Invitrogen, Fisher Scientific and Unity Lab Services – we offer an unmatched combination of innovative technologies, purchasing convenience and comprehensive services. For more information, please visit www.thermofisher.com.  ",Biotechnology,46979,https://media-exp1.licdn.com/dms/image/C4E0BAQHX2VR2XPQBjQ/company-logo_400_400/0?e=1613606400&v=beta&t=IVyrIEb4gSb0EDqEcsbGTG_vHI2EOW4AV6CtJxauc6Y,10001+,"168 Third Avenue,MA,Waltham,United States",United States,MA,Waltham,,,168 Third Avenue,10/08/2018 16:14,14/11/2020 19:44,https://www.linkedin.com/company/thermo-fisher-scientific/
3131,The HEINEKEN Company,"Amsterdam, North Holland, Netherlands",http://www.theHEINEKENcompany.com,theheinekencompany.com,"HEINEKEN - the world's most international brewer. It is the leading developer and marketer of premium beer and cider brands. Led by the Heineken® brand, the Group has a portfolio of more than 300 international, regional, local and speciality beers and ciders. We are committed to innovation, long-term brand investment, disciplined sales execution and focused cost management.  Through ""Brewing a Better World""​, sustainability is embedded in the business and delivers value for all stakeholders. HEINEKEN has a well-balanced geographic footprint with leadership positions in both developed and developing markets.  We employ over 80,000 employees and operate breweries, malteries, cider plants and other production facilities in more than 70 countries. Our most recent information is available on: www.theHEINEKENcompany.com and follow us on Twitter via @HEINEKENCorp.",Food & Beverages,14701,https://media-exp1.licdn.com/dms/image/C4D0BAQFCDsNQrphkgg/company-logo_400_400/0?e=1613001600&v=beta&t=eJVl0R48w7XAFJ4oJmP_t-52-AdW59n8OZ8FtXXh1wI,10001+,"Tweede Weteringsplantsoen 21,1017 ZD,Amsterdam,Netherlands",Netherlands,,Amsterdam,,1017 ZD,Tweede Weteringsplantsoen 21,09/08/2018 11:14,12/11/2020 16:33,https://www.linkedin.com/company/heineken/
3240,Farmers Insurance,,http://www.farmers.com,farmers.com,"The companies comprising the Farmers Insurance Group of Companies® currently make up one of the country's largest insurers of vehicles, homes and small businesses, and provide a wide range of other specialty insurance and financial services products.   In business since 1928, today at Farmers® we proudly serve more than 10 million households with more than 19 million individual insurance policies across all 50 states through the efforts of nearly 48,000 exclusive and independent agents and approximately 21,000 employees. Our experience provides a rich history and legacy of service and strong customer relationships, while our focus on smart innovation, technology and entrepreneurship helps us to stay creative, to continually improve our product offerings and to drive the evolution of the insurance industry. Farmers Insurance Exchange®, the largest of the three primary insurance insurers that make up Farmers Insurance, is recognized as one of the largest U.S. companies on the 2017 Fortune 500 list.  At Farmers®, we understand that every encounter with customers is an opportunity to differentiate ourselves with our personalized service and have an overall positive impact on their lives.  We pride ourselves on helping the individuals and businesses we serve become smarter and better prepared to protect the things that matter most to them.   We are also deeply committed to giving back. The Farmers culture is built around opportunities to volunteer and help improve the communities in which we work and live. ",Insurance,47304,https://media-exp1.licdn.com/dms/image/C560BAQFk2-imQqiwNg/company-logo_400_400/0?e=1614816000&v=beta&t=lipV1l9GlIqmaN5czs2sWkneraxvSHKnsTWj6QdEPwE,10001+,"6301 Owensmouth Ave,CA,Woodland Hills,United States",United States,CA,Woodland Hills,91367,,6301 Owensmouth Ave,12/08/2018 21:08,01/12/2020 21:27,https://www.linkedin.com/company/farmers-insurance/
