Id,Name,Location,Website,Domain,Description,Industry,EmployeeCount,Logo,EmployeeCountRange,Headquarters,Country,GeographicArea,City,PostalCode,AddressLine2,AddressLine1,Created,Modified,PublicProfileUrl
74627450,Montessori With Ted,"Dublin, County Dublin, Ireland",https://www.montessoriwithted.com/,montessoriwithted.com,"https://www.instagram.com/montessoriwithted/   +10k followers on instagram  Montessori with Ted Sensory Play kits are messy play activity kits for children. We help parents provide their children with the benefits of Sensory play without the hassle and stress of where to start. Messy play is extremely important for a child's development and it can be difficult for parents to source the materials and time to put an activity together. We are here to take that stress away and provide fun, educational, high quality sensory kits.",Arts and Crafts,1,https://media-exp1.licdn.com/dms/image/C4E0BAQFyVriLg4lNtw/company-logo_400_400/0/1609845334882?e=1618444800&v=beta&t=MHyY4zGC4gJFjq8Qck_6Jf--f7TSVtak54DIMG0PZx0,02-Oct,"Dublin,Ireland",Ireland,,Dublin,,,,08/01/2021 13:29,08/01/2021 13:29,https://www.linkedin.com/company/montessori-with-ted/
74618819,CHERRY ST,"New York, New York, United States",https://www.cherrystcollective.com/,cherrystcollective.com,"At Cherry St, we take care of your creative and strategic needs so you can focus on running your business at its full potential. We’re driven by technology as much as design and content to ensure we fulfill our key mission of helping our clients achieve their successful future.  WHAT WE DO: • Brand Development & Positioning • Brand Strategy • Licensing & Portfolio Strategy • Product Development & Merchandising • Competitive & Trend Analysis • Creative Direction • Marketing & Digital Media • Media Planning & Buying",Marketing and Advertising,1,https://media-exp1.licdn.com/dms/image/C4E0BAQGpg50WpFML_w/company-logo_400_400/0/1609812561161?e=1617840000&v=beta&t=pmQy_VgPTzM0EF-5_7jJkH9Xq0MpEGjNIe16NNiDwRI,02-Oct,"225 Cherry Street,New York,New York,United States",United States,New York,New York,10002,,225 Cherry Street,07/01/2021 21:18,07/01/2021 21:18,https://www.linkedin.com/company/cherry-st-llc/
74618620,David R Oxley Advisory,"Austin, Texas, United States",http://davidroxley.com,davidroxley.com,"David R Oxley provides board level advisory services with expertise in people, organization, and culture change. ",Management Consulting,1,https://media-exp1.licdn.com/dms/image/C4E0BAQFeJSUQuwOu5g/company-logo_400_400/0/1609798594555?e=1618444800&v=beta&t=NJg10ByQFp-6qusAXhkF9FOY1Inf3pANIWdgHL_qMxg,myself only,"TX,Austin,United States",United States,TX,Austin,,,,08/01/2021 14:47,08/01/2021 14:47,https://www.linkedin.com/company/david-r-oxley/
74614683,Lotti Building Chemicals,"Istanbul, Istanbul, Turkey",http://www.lotti.com.tr,lotti.com.tr,LOTTI continues its development and now offers you a wide range of Special Products covering the 6 areas of applications below: • Tile Adhesives and Joint Fillers • Waterproofing • Floor & Wall Coverings • Mortars & Anchoring • Sealing & Bonding • Additives & Priming ,Building Materials,1,https://media-exp1.licdn.com/dms/image/C4E0BAQGsFR37Jq1sGQ/company-logo_400_400/0/1609781562709?e=1618444800&v=beta&t=7cOOxPStYHQ-TOHsHy3XybmdRny_ZulmVCEBNc587bs,Nov-50,"Eski Bagdat Cd.,istanbul,Turkey",Turkey,,istanbul,,,Eski Bagdat Cd.,10/01/2021 21:42,10/01/2021 21:42,https://www.linkedin.com/company/lotti-building-chemicals/
74611568,Bella Popera,"London, England, United Kingdom",http://www.bellapopera.com,bellapopera.com,"Bella Popera brings together three young multi-lingual sopranos whose self-appointed brief in life is to deliver a breathtaking set of operatic arias and chart-topping covers with panache and flair.    This delightful classical crossover trio has created an engaging repertoire that sets out to build musical bridges between contrasting genres, giving a stylish twist to familiar songs.  Their carefully crafted three-part harmonies of operatic arias, chart-topping hits, and musical theatre classics are guaranteed to enchant and delight in equal measure. ​ Bella Popera is rightly proud of its cultural and linguistic diversity and are equally at ease performing in English, Spanish and French - perfect for both premium cruising and corporate events.  Whether singing Louis Armstrong’s timeless classic ‘What a Wonderful World’ - first released back in the mid-sixties - or Camilla Camello’s edgy ‘Havana’ which topped the charts just a year ago – Bella Popera are at the very top of their crossover game when creating innovative harmonies of hit songs. ",Music,1,https://media-exp1.licdn.com/dms/image/C4E0BAQEZnW865x-jeg/company-logo_400_400/0/1609771177154?e=1617840000&v=beta&t=qnZcM1lASqeoXHF3f5JfEMfPOWw65As2aljAQMzr2JE,02-Oct,"London,United Kingdom",United Kingdom,,London,,,,05/01/2021 14:33,05/01/2021 14:33,https://www.linkedin.com/company/bella-popera/
74609631,I-Dew Eye Drops,"Seven Sisters, England, United Kingdom",http://i-dew.co.uk,i-dew.co.uk,"I-DEW® Eye Drops are specially developed in the laboratories of Entod International by british dry eye researchers for relief of dry, strained and irritated eyes due to contact lens wear and over-exposure to smartphone & computer screens.","Health, Wellness and Fitness",0,https://media-exp1.licdn.com/dms/image/C4E0BAQHQo0WLi4isJQ/company-logo_400_400/0/1609760345144?e=1617840000&v=beta&t=bubtcml4tlfoQ2CLulMFO7fVxDoObgQqnORfAWtQYHg,501-1000,"15 Tottenham Lane,Hornsey,London,United Kingdom",United Kingdom,,London,N15 3HB,Hornsey,15 Tottenham Lane,06/01/2021 14:24,06/01/2021 14:24,https://www.linkedin.com/company/idewuk/
74606596,Fritso,"Weert, Limburg, Netherlands",http://www.fritso.nl,fritso.nl,In de wereld van sensoren (IoT) is een wilgroei aan ontstaan met aan 1 kant de leveranciers van sensoren en aan de andere kant de 'data lake' solutions.  Onze focus ligt op de gehele keten. Samen met onze partners zorgen wij voor de keten van 'Meten tot Weten' hierbij wordt data verzamelt van de bronnen die als basis dienen. Deze data wordt genormaliseerd en samen met al beschikbare data op de markt (b.v. Weersinvloeden) gepresenteerd aan de partijen die hierop geabonneerd zijn.   De klant kan zich volledig concentreren op het gebruiken van Informatie om tot nieuwe inzichten en besluiten te komen. ,Information Technology and Services,1,https://media-exp1.licdn.com/dms/image/C4E0BAQEnA3wQXfV5DA/company-logo_400_400/0/1609752234621?e=1617840000&v=beta&t=pKUVxVRVzht1U533Oq5eMFaZeq-VRboGBzPNNZswq8U,02-Oct,"Koenderstraat 2,Limburg,Weert,Netherlands",Netherlands,Limburg,Weert,6003PR,,Koenderstraat 2,07/01/2021 07:24,07/01/2021 07:24,https://www.linkedin.com/company/fritso/
74600337,Stagecoach Performing Arts Stanmore & Harrow Weald,"London, England, United Kingdom",http://www.stagecoach.co.uk/stanmore,stagecoach.co.uk,Part time performing arts school for children aged 2-4 4-6 6-16 and advanced class for ages 14+,Education Management,1,https://media-exp1.licdn.com/dms/image/C4E0BAQHt_aa0HOunkQ/company-logo_400_400/0/1609683332540?e=1617840000&v=beta&t=DaqazcN7Tez9O68ZTIIHPbJSRVh8z6a5Jed2UcOI3d8,Nov-50,"Whitchurch Primary School and Nursery,Wemborough Road,Stanmore,United Kingdom",United Kingdom,,Stanmore,HA7 2DU,Wemborough Road,Whitchurch Primary School and Nursery,06/01/2021 10:48,06/01/2021 10:48,https://www.linkedin.com/company/stagecoach-performing-arts-stanmore-harrow-weald/
74599103,Ridish Technologies,"Ghaziabad, Uttar Pradesh, India",http://ridishtechnologies.com/,ridishtechnologies.com,"We bring our diverse background of advertising, design, branding, public relations, research and strategic planning to work for your company. Not only will your materials look great – they will get results.",Information Technology and Services,1,https://media-exp1.licdn.com/dms/image/C4E0BAQH9gMfTib3_9w/company-logo_400_400/0/1609654979781?e=1617840000&v=beta&t=CZd4nMtBLhodELFMiHwYYwaISF6MicKcfkAj2tjx8m8,201-500,"Uttar Pradesh,Vaishali,India",India,Uttar Pradesh,Vaishali,201010,,,07/01/2021 08:07,07/01/2021 08:07,https://www.linkedin.com/company/ridish-technologies/
74598745,PHB Executive Services ,"London, England, United Kingdom",https://phbexecutive.co.uk/,phbexecutive.co.uk,"PHB Executive Services Ltd. offers 20+ years Business Management experience, including; Operational Management, Sales and Customer Service Management and Training, Recruitment, Coaching, Business Analysis,  and Marketing and Media Development.   In addition to executive services for businesses, PHB Executive Services offer experienced and qualified support for individuals, such as;  CV Development, Interview Preparation, Personal Development Plans, Life Coaching, Welfare Benefit Support, and Advocacy Services.   PHB Executive Services Ltd. strives to achieve results through a holistic approach by ensuring all aspects to individual or business development and growth are considered and approved upon.    ""You never know what you can achieve unless you take a chance.  It is time for you to step out of your comfort zone and realize what wonderful things await you!""  - Sabrina Palmer, Founder of PHB Exec. Serv. Ltd. ",Management Consulting,1,https://media-exp1.licdn.com/dms/image/C4E0BAQHKLfgTBocpBQ/company-logo_400_400/0/1609695021573?e=1617840000&v=beta&t=-Ob9OMOfHltuHVm6vu9TfBBkKCnQyLkLYRTUdY-50GA,myself only,"London,United Kingdom",United Kingdom,,London,,,,06/01/2021 12:49,06/01/2021 12:49,https://www.linkedin.com/company/phb-executive-services-ltd/
74598636,Tushek Supercars,"Pesnica pri Mariboru, Municipality of Pesnica, Slovenia",http://www.tushek.eu,tushek.eu,"Tushek Supercars builds exquisite race-bred hypercars with key focus on low weight and pure balance of power to weight ratio. The guiding principles of manufacturing make use of innovative drivetrain technologies to achieve the purest handling characteristics on and off track, combined with an utmost dedication to detailed quality of construction. Founded in 2008 by Aljosa Tušek, the Slovenian racing champion, the Company hails its commitment to the purpose of building the ultimate driver's car. Tushek Supercars has produced to date 4 models and gained worldwide acknowledgment for its performance, quality and, most especially, for the firsthand application of new technologies for automotive use. The Tushek TS 900 Apex, Company's latest model to start production, is known as the ""World's lightest hybrid hypercar"" achieving the 1:1 Power to Weight Ratio by using aviation grade electric drive technologies combined with a high-performance ICU, producing a total combined output of over 1350 HP for a weight of under 1350 KG. All Tushek cars are produced on limited series only, with a high degree of customer personalization options, but limited to parts not affecting performance.",Automotive,1,https://media-exp1.licdn.com/dms/image/C4E0BAQHSDgnd3r_vMw/company-logo_400_400/0/1609691079497?e=1618444800&v=beta&t=ZPE5TYck00yB3I2B20nvbOeId3GtYMB2iI8Sbgou7eg,Nov-50,"Spodnje Dobrenje 42a,Pesnica pri Mariboru ,Slovenia",Slovenia,,Pesnica pri Mariboru ,2211,,Spodnje Dobrenje 42a,08/01/2021 19:56,08/01/2021 19:56,https://www.linkedin.com/company/tushek-supercars/
74598491,Cult Digital,,https://cult-digital.com,cult-digital.com,"Seamless Collaboration With Seasoned Experts  Cult Digital offers a bespoke white label service that encompasses design, development and strategic digital consultancy. A consistent and ultra-flexible approach makes us indispensable in our client's growth.  At the core we are a full service digital consultancy with a talented and multi-disciplined creative team. Our work is exclusively B2B - empowering ambitious creative agencies by supplementing their service offering, delivering expert consultancy or simply handling overflow.   We love to build lasting relationships and our single goal is to help your business grow. Your success is our bottom line! And our approach is simple - to consistently deliver the highest quality Development, Design and Consultancy.  Contact us to discuss your requirements - studio@cult-digital.com",Online Media,1,https://media-exp1.licdn.com/dms/image/C4E0BAQFZ2IFUOvh6gQ/company-logo_400_400/0/1609680330283?e=1617840000&v=beta&t=B7PTmjmftEjGhRaSpxh_RSrK2Y6YpcIn_gDbuwYnOdk,02-Oct,,,,,,,,04/01/2021 10:28,04/01/2021 10:28,https://www.linkedin.com/company/cultdigital/
74595158,Denneker,"Manchester, England, United Kingdom",http://www.dennekerresearch.co.uk/,dennekerresearch.co.uk,"We are a forward thinking, skilled and efficient group of financial advisors who are specialised within the Research and Development Tax Relief sector. We are able to retrieve substantial entitlements for our clients so that you can continue innovating.",Financial Services,1,https://media-exp1.licdn.com/dms/image/C4E0BAQEsxsCOYKF9og/company-logo_400_400/0/1609628513764?e=1617840000&v=beta&t=H1uxI4zjmGGlIMdv-1xdDKATEPy_gKRXBO8-xQu3gLo,02-Oct,"Greater Manchester,Manchester,United Kingdom",United Kingdom,Greater Manchester,Manchester,m15,,,06/01/2021 11:02,06/01/2021 11:02,https://www.linkedin.com/company/denneker/
74593243,Soufi Company,"Strand, England, United Kingdom",http://www.souficompany.com,souficompany.com,A commerce & communication parent company.,Retail,1,https://media-exp1.licdn.com/dms/image/C4E0BAQFlTUCYyxTKWQ/company-logo_400_400/0/1609595268136?e=1618444800&v=beta&t=zc777iAhNacpEL-HHAXMsgQLGBzMCBEnhuu-c3CC1c4,02-Oct,"Londres,Londres,United Kingdom",United Kingdom,Londres,Londres,WC2N 5DU,,,10/01/2021 08:04,10/01/2021 08:04,https://www.linkedin.com/company/soufi-company-ltd/
74591317,Hayward Eats.Com,"Hayward, California, United States",http://www.haywardeats.com,haywardeats.com,"Hayward eats is a local small business guide that brings positive exposure to local restaurants, food and drink places and entrepreneurs to increase revenue and create community growth.",Newspapers,1,https://media-exp1.licdn.com/dms/image/C4E0BAQGjqg1f0N4-Pw/company-logo_400_400/0/1609586037058?e=1618444800&v=beta&t=XndFUv-ecPmoC3iPRsIb-6K3nCeGzqbFEXidaShD38c,02-Oct,"Ca,Hayward,United States",United States,Ca,Hayward,94541,,,11/01/2021 11:58,11/01/2021 11:58,https://www.linkedin.com/company/haywardeats-com/
74590586,Scott Waste,"Bridgend, Wales, United Kingdom",https://www.scottwaste.co.uk/,scottwaste.co.uk,"Scott Waste operates a fully licensed and accredited waste transfer station which enables us to recycle as much of our customers waste as possible.   We service both commercial & domestic clients across South Wales. We are also a council approved contractor providing a variety of services across the major councils.   We pride ourselves on our level of service and strong customer relationships, something which is at the forefront of our company ethos.",Environmental Services,1,https://media-exp1.licdn.com/dms/image/C4E0BAQHaLNaJZHBACQ/company-logo_400_400/0/1609599264522?e=1617840000&v=beta&t=-BDbi5V-be9AsVink-NhOHJZN--bIZKhezRjbEG53xg,Nov-50,"9/10 Village Farm Road,Wales,Bridgend,United Kingdom",United Kingdom,Wales,Bridgend,,,9/10 Village Farm Road,07/01/2021 18:14,07/01/2021 18:14,https://www.linkedin.com/company/scott-waste/
74590529,tom_mark.,"West Ealing, England, United Kingdom",http://www.tom-mark.com,tom-mark.com,"Think about where you are.  The place.  The environment.   How does it make you feel?   Distracted?  Excited?  Calm?    One of the things I love about London is its variety. As you move from one place to another it always makes you feel a bit different. Sometimes the simplest things can spark an interest, emotion or action.   Like when you're at Wembley Stadium and your team scores. You shout at the top of your voice, maybe even spontaneously hugging the stranger next to you.  Or when you’ve just walked into your favourite cafe, your face tingles from the sudden warmth, the coffee smell welcomes you and within moments, you feel relaxed and safe.  All these places influence you, triggering a wash of emotions that starts actions.  Now imagine your brand is a place.    How would you describe it? What emotions would it trigger? Who would you make it for?   I believe that every brand can be unique; you just have to get to know it, hear its story, extract and combine all the elements that prove its quality…  And make it remarkable.    And that’s what we do.  (Brand Positioning Statement) Tom Mark is a design studio based in London, creating authentic visual branding stories across all disciplines through unique DRC methodology. For anyone wanting to leave their mark on the world. ",Graphic Design,1,https://media-exp1.licdn.com/dms/image/C4E0BAQFd1EqtogAScA/company-logo_400_400/0/1609595575140?e=1618444800&v=beta&t=HoUrdVcxOmZJpHtxIaz11qnx5A4xZS2IBPbJil5BlRY,myself only,"42 Pershore House Singapore Road,,London,United Kingdom",United Kingdom,,London,W130UL,,"42 Pershore House Singapore Road,",10/01/2021 10:38,10/01/2021 10:38,https://www.linkedin.com/company/tom-mark/
74589781,Run Mr Run,"London, England, United Kingdom",https://runmrrun.com/mr-runs-running-shop/,runmrrun.com,"Creating total nutritional solutions for runners. All-in-one pre-, during- and post-run supplements that provide total nutrients for runners' hydration, energy, endurance, strength and post-race recovery requirements.  Suitable for recreational short-distance beginner runners (5k plus) as well as experienced, high fitness level marathon-distance runners.  BE.YOUR.BEST. No compromise.",Food Production,1,https://media-exp1.licdn.com/dms/image/C4E0BAQEX561oKBmDuA/company-logo_400_400/0/1609605871023?e=1617840000&v=beta&t=nUvIOESbh4BmFtcImd2hK1keP-jNVRh61QxztN1ANUc,02-Oct,"Frederick Street,Greater London,London,United Kingdom",United Kingdom,Greater London,London,WC1,,Frederick Street,04/01/2021 00:16,04/01/2021 00:16,https://www.linkedin.com/company/run-mr-run/
74587909,Professional Insurance Claim Consultancy Solutions (PICC Solutions),"London, England, United Kingdom",http://www.piccsolutions.org,piccsolutions.org,A specialist Insurance and Reinsurance consultancy delivering expert and pragmatic solutions to clients' complex or contentious claims and challenging insurance projects.,Insurance,1,https://media-exp1.licdn.com/dms/image/C4E0BAQE2yt-NaGsMWQ/company-logo_400_400/0/1609508339585?e=1617840000&v=beta&t=GwmU0DD4_iZ0pONqLthDjZnz97_gU9QTiIw_Fma-KR0,02-Oct,"London,United Kingdom",United Kingdom,,London,,,,06/01/2021 14:07,06/01/2021 14:07,https://www.linkedin.com/company/professional-insurance-claim-consultancy-solutions-limited-picc-solutions-ltd/
74583839,CBSLLC,"Scotch Plains, New Jersey, United States",http://www.cbsllc.us/,cbsllc.us,"CBS is a fast growing, IT organization providing end-to-end information technology services to several global organizations from the domains such as Financial Services, Insurance, Health Care Services, Manufacturing, Retail, Energy and Utilities. CBS delivers highly responsive and innovative solutions that help clients to align their IT strategy with their business goals. CBS provides a full portfolio of services so that it could be a one-stop IT provider. The services are - IT Consulting, Application Development and Management, QA Testing, Outsourced Product Development, Enterprise Software Solutions, Business Intelligence & Data Warehousing as well as Resource Augmentation.",Staffing and Recruiting,5,https://media-exp1.licdn.com/dms/image/C4E0BAQECM_yHrP0OMQ/company-logo_400_400/0/1609527517717?e=1617840000&v=beta&t=g-B7MieN8RCiT3_jl9AJI5QgCH2guN7UwB5ywJs8OyI,201-500,"1812 Front St,New Jersey,Scotch Plains,United States",United States,New Jersey,Scotch Plains,7076,,1812 Front St,07/01/2021 16:29,07/01/2021 16:29,https://www.linkedin.com/company/cbsllc/
74581462,Rovet Scientific,"Benin City, Edo, Nigeria",http://www.rovetscientific.com,rovetscientific.com,"ROVET SCIENTIFIC is a distinguished organization that has gained a high reputation for itself where ever it has had a cause to transact business in respect to the supply of genuine and high-grade Laboratory and Hospital Equipment, Chemicals and Consumables for both routine and specialty research.   Our watchword is Quality and Customer Satisfaction. We achieve this by providing only the best products and offering excellent professional services at competitive prices.  We have been in the industry for more than 15 years and we distribute laboratory products for over 7 globally recognized companies, including but not limited to CAMLAB U.K, UGO BASILE S.r.I italy, IRMECO, Scharlau etc.",Biotechnology,1,https://media-exp1.licdn.com/dms/image/C4E0BAQER_s446YHvLQ/company-logo_400_400/0/1609452220634?e=1617840000&v=beta&t=0U1WWS8GIXD_g7tRllCNAn49moPSs2xCtzsVBwjWlvc,Nov-50,"1 Wire Road,Edo,Benin-City,Nigeria",Nigeria,Edo,Benin-City,,,1 Wire Road,05/01/2021 12:55,05/01/2021 12:55,https://www.linkedin.com/company/rovetscientific/
74580009,Dataverage,"Istanbul, Istanbul, Turkey",http://dataverage.com,dataverage.com,"In today’s competitive world, investors need an edge over their competitors.   Dataverage are dedicated to providing scientific data delivered in an easy to understand format that offers an opportunity for financial networks to make informed decisions and improve overall performance.   Our core services focus on providing quality finance data to help you make reliable decisions.   We offer a range of services including static and interactive performance reports, dashboards of key performance indicators, data collection, invest benchmarking tools and financial services.",Computer Software,1,https://media-exp1.licdn.com/dms/image/C4E0BAQFSrJcn0-Tvjg/company-logo_400_400/0/1609406461035?e=1617840000&v=beta&t=a9kTT9qMJHEqrcA7aHPP9REoBj3Q7HpNb7jTEYmFHpU,02-Oct,"Moda Mektebi Sokak,İstanbul,Kadıköy,Turkey",Turkey,İstanbul,Kadıköy,34710,,Moda Mektebi Sokak,02/01/2021 22:52,02/01/2021 22:52,https://www.linkedin.com/company/dataverage/
74576515,NouvelleBox,,http://www.nouvellebox.com,nouvellebox.com,,Apparel & Fashion,1,https://media-exp1.licdn.com/dms/image/C4E0BAQFpyHEYVVucDw/company-logo_400_400/0/1609407302697?e=1617840000&v=beta&t=kD6epWN9MjKH61DyvMRdRRkTw7nLYz1xvNV7KXuUN5U,02-Oct,,,,,,,,07/01/2021 19:50,07/01/2021 19:50,https://www.linkedin.com/company/nouvellebox/
74573924,Cerveza Checa I Czech Beer (CEIDEX),,http://www.cervezacheca.com,cervezacheca.com,"+18 años. Especialistas en cerveza checa desde 1943. Cervezas, maltas, lúpulos, fábricas y marca blancas así como equipamientos de dispensado singulares.  Aparte de fábricas propias en Ostrava y Praga (www.royalczechbeer.cz) donde elaboramos cervezas de alta calidad siguiendo los cánones tradicionales checos de elaboración, importamos cervezas checas de diferentes pivovares al mercado ibérico asesorando, asimismo, a otras empresas interesadas en cerveza checa para mercados internacionales.  Comercializamos los mejores lúpulos checos así como las maltas. Asesoramos en equipamientos para fabricación y dispensado y trabajamos el producto llave en mano para que cualquier persona y/o profesional pueda elaborar su cerveza para consumo del público de su negocio.  Contamos con los mejores profesionales checos y especialistas en mercados internacionales así como en todo el mercado checo actual tanto de craft beer como de cerveza industrial.",Import and Export,1,https://media-exp1.licdn.com/dms/image/C4E0BAQE_AnE0jB2JKw/company-logo_400_400/0/1609345733518?e=1617840000&v=beta&t=AQXXK4f9wGiR6EXvVhHbXjHl8wbKFQ2Cn1musPHfM5g,02-Oct,,,,,,,,05/01/2021 23:27,05/01/2021 23:27,https://www.linkedin.com/company/cerveza-checa-czech-beer/
74472583,JNG Career Consulting,"Austin, Texas, United States",https://www.jngcareerconsulting.com,jngcareerconsulting.com,"To compete in this virtual job climate you'll need an impeccable  resume and a standout LinkedIn profile. I'll help you get your resume and network into pristine shape and ready for recruiters, interviewers, and applicant tracking systems alike. I'm a recruiter with over 4 years of experience in people operations, and over 40,000 resumes reviewed onsite at Google. My mission is to help you develop professionally, and empower you to land the job of your dreams!  Set up a discovery call today!  Evolve or Repeat? The choice is yours.",Professional Training & Coaching,1,https://media-exp1.licdn.com/dms/image/C4E0BAQEryIcJVjSK9A/company-logo_400_400/0/1609370991919?e=1617840000&v=beta&t=oFRqyeWgnDDCFTWhj7QNyU4-E1R8_SEZ1cENb0f1s5I,myself only,"Texas,Austin,United States",United States,Texas,Austin,,,,05/01/2021 15:21,05/01/2021 15:21,https://www.linkedin.com/company/jng-career-consulting/
74471295,Lalabuy,,http://lalabuy.io,lalabuy.io,Revolutionizing the music industry through an all-in-one platform raising capital directly from fans to directly connect artists with all industry professionals.,Computer Software,1,https://media-exp1.licdn.com/dms/image/C4E0BAQEdrIhfyledcg/company-logo_400_400/0/1609346950245?e=1618444800&v=beta&t=F818RcdA2vi8qwyWr8ppNsKJscqnnCQKWpqJ9IZ5XO4,02-Oct,,,,,,,,11/01/2021 09:55,11/01/2021 09:55,https://www.linkedin.com/company/lalabuy/
74469987,Möja Vandrarhem,"Stockholm, Stockholm County, Sweden",http://www.mojavandrarhem.se/,mojavandrarhem.se,A small family-run hostel on the island of Möja in the Stockholm archipelago.,"Leisure, Travel & Tourism",1,https://media-exp1.licdn.com/dms/image/C4E0BAQGDZS_nPr2BeQ/company-logo_400_400/0/1609321402100?e=1617840000&v=beta&t=CuixrXhbaE2-iQ9dDb9y1ULozqVv04Ti91BkeRYzbcM,myself only,"Bergs by 173,Möja,Sweden",Sweden,,Möja,13043,,Bergs by 173,03/01/2021 23:37,03/01/2021 23:37,https://www.linkedin.com/company/m%C3%B6ja-vandrarhem/
